financialYear,financialQuarter,forceName,offenceDescription,offenceGroup,offenceSubgroup,offenceCode,numberofOffences
2023/24,1,Lincolnshire,Forgery or use of false drug prescription,Miscellaneous crimes against society,Miscellaneous crimes against society,60,0
2023/24,1,Lincolnshire,"Fraud, forgery etc associated with vehicle or driver records",Miscellaneous crimes against society,Miscellaneous crimes against society,814,0
2023/24,1,Lincolnshire,"Going equipped for stealing, etc",Miscellaneous crimes against society,Miscellaneous crimes against society,33,8
2023/24,1,Lincolnshire,Handling stolen goods,Miscellaneous crimes against society,Miscellaneous crimes against society,54,5
2023/24,1,Lincolnshire,Harassment,Violence against the person,Stalking and harassment,8L,602
2023/24,1,Lincolnshire,Incest or familial sexual offences,Sexual offences,Other sexual offences,23,10
2023/24,1,Lincolnshire,Infanticide,Violence against the person,Homicide,4.2,0
2023/24,1,Lincolnshire,Intentional destruction of a viable unborn child,Violence against the person,Violence with injury,4.3,0
2023/24,1,Lincolnshire,Interfering with a motor vehicle,Theft offences,Vehicle interference,126,95
2023/24,1,Lincolnshire,Kidnapping,Violence against the person,Violence without injury,36,16
2023/24,1,Lincolnshire,Making off without payment,Theft offences,Other theft offences,49A,116
2023/24,1,Lincolnshire,"Making, supplying or possessing articles for use in fraud",Miscellaneous crimes against society,Miscellaneous crimes against society,33A,1
2023/24,1,Lincolnshire,Malicious Communications,Violence against the person,Stalking and harassment,8R,558
2023/24,1,Lincolnshire,Manslaughter,Violence against the person,Homicide,4.1,1
2023/24,1,Lincolnshire,Modern slavery,Violence against the person,Violence without injury,106,29
2023/24,1,Lincolnshire,Murder,Violence against the person,Homicide,1,3
2023/24,1,Lincolnshire,Obscene publications etc,Miscellaneous crimes against society,Miscellaneous crimes against society,86,182
2023/24,1,Lincolnshire,Offender Management Act offences,Miscellaneous crimes against society,Miscellaneous crimes against society,69,11
2023/24,1,Lincolnshire,Other criminal damage,Criminal damage and arson,Criminal damage,58D,464
2023/24,1,Lincolnshire,Other drug offences,Drug offences,Possession of drugs,92C,1
2023/24,1,Lincolnshire,Other firearms offences,Possession of weapons offences,Possession of weapons offences,81,24
2023/24,1,Lincolnshire,Other forgery,Miscellaneous crimes against society,Miscellaneous crimes against society,61,11
2023/24,1,Lincolnshire,Other knives offences,Possession of weapons offences,Possession of weapons offences,90,0
2023/24,1,Lincolnshire,Other miscellaneous sexual offences,Sexual offences,Other sexual offences,88C,0
2023/24,1,Lincolnshire,Other notifiable offences,Miscellaneous crimes against society,Miscellaneous crimes against society,99,14
2023/24,1,Lincolnshire,Other offences against the State or public order,Public order offences,Public order offences,66,306
2023/24,1,Lincolnshire,Other theft,Theft offences,Other theft offences,49,750
2023/24,1,Lincolnshire,Perjury,Miscellaneous crimes against society,Miscellaneous crimes against society,67,0
2023/24,1,Lincolnshire,Perverting the course of justice,Miscellaneous crimes against society,Miscellaneous crimes against society,79,19
2023/24,1,Lincolnshire,Possession of article with blade or point,Possession of weapons offences,Possession of weapons offences,10D,66
2023/24,1,Lincolnshire,Possession of controlled drugs (Cannabis),Drug offences,Possession of drugs,92E,176
2023/24,1,Lincolnshire,Possession of controlled drugs (excl. Cannabis),Drug offences,Possession of drugs,92D,104
2023/24,1,Lincolnshire,Possession of false documents,Miscellaneous crimes against society,Miscellaneous crimes against society,61A,0
2023/24,1,Lincolnshire,Possession of firearms offences,Possession of weapons offences,Possession of weapons offences,10B,11
2023/24,1,Lincolnshire,Possession of firearms with intent,Possession of weapons offences,Possession of weapons offences,10A,8
2023/24,1,Lincolnshire,Possession of other weapons,Possession of weapons offences,Possession of weapons offences,10C,56
2023/24,1,Lincolnshire,Procuring illegal abortion,Violence against the person,Violence without injury,14,0
2023/24,1,Lincolnshire,Profiting from or concealing knowledge of the proceeds of crime,Miscellaneous crimes against society,Miscellaneous crimes against society,38,5
2023/24,1,Lincolnshire,"Public fear, alarm or distress",Public order offences,Public order offences,9A,819
2023/24,1,Lincolnshire,Racially or religiously aggravated assault with injury,Violence against the person,Violence with injury,8P,4
2023/24,1,Lincolnshire,Racially or religiously aggravated assault without injury,Violence against the person,Violence without injury,105B,6
2023/24,1,Lincolnshire,Racially or religiously aggravated criminal damage,Criminal damage and arson,Criminal damage,58J,4
2023/24,1,Lincolnshire,Racially or religiously aggravated harassment,Violence against the person,Stalking and harassment,8M,6
2023/24,1,Lincolnshire,"Racially or religiously aggravated public fear, alarm or distress",Public order offences,Public order offences,9B,87
2023/24,1,Lincolnshire,Rape of a Female - Multiple Undefined Offenders,Sexual offences,Rape offences,19J,0
2023/24,1,Lincolnshire,Rape of a female aged 16 and over,Sexual offences,Rape offences,19C,144
2023/24,1,Lincolnshire,Rape of a female child under 13,Sexual offences,Rape offences,19E,20
2023/24,1,Lincolnshire,Rape of a female child under 16,Sexual offences,Rape offences,19D,36
2023/24,1,Lincolnshire,Rape of a Male - Multiple Undefined Offenders,Sexual offences,Rape offences,19K,0
2023/24,1,Lincolnshire,Rape of a male aged 16 and over,Sexual offences,Rape offences,19F,7
2023/24,1,Lincolnshire,Rape of a male child under 13,Sexual offences,Rape offences,19H,7
2023/24,1,Lincolnshire,Rape of a male child under 16,Sexual offences,Rape offences,19G,1
2023/24,1,Lincolnshire,Residential burglary of a home,Theft offences,Domestic burglary,28I,284
2023/24,1,Lincolnshire,Residential burglary of unconnected building,Theft offences,Domestic burglary,28M,144
2023/24,1,Lincolnshire,Robbery of business property,Robbery,Robbery of business property,34A,16
2023/24,1,Lincolnshire,Robbery of personal property,Robbery,Robbery of personal property,34B,74
2023/24,1,Lincolnshire,Sexual activity etc with a person with a mental disorder,Sexual offences,Other sexual offences,70,1
2023/24,1,Lincolnshire,Sexual activity involving a child under 13,Sexual offences,Other sexual offences,21,21
2023/24,1,Lincolnshire,Sexual activity involving child under 16,Sexual offences,Other sexual offences,22B,49
2023/24,1,Lincolnshire,Sexual assault on a female aged 13 and over,Sexual offences,Other sexual offences,20A,155
2023/24,1,Lincolnshire,Sexual assault on a female child under 13,Sexual offences,Other sexual offences,20B,55
2023/24,1,Lincolnshire,Sexual assault on a male aged 13 and over,Sexual offences,Other sexual offences,17A,24
2023/24,1,Lincolnshire,Sexual assault on a male child under 13,Sexual offences,Other sexual offences,17B,11
2023/24,1,Lincolnshire,Sexual grooming,Sexual offences,Other sexual offences,88A,36
2023/24,1,Lincolnshire,Shoplifting,Theft offences,Shoplifting,46,1442
2023/24,1,Lincolnshire,Soliciting for the purposes of prostitution,Miscellaneous crimes against society,Miscellaneous crimes against society,27,0
2023/24,1,Lincolnshire,Stalking,Violence against the person,Stalking and harassment,8Q,392
2023/24,1,Lincolnshire,Theft by an employee,Theft offences,Other theft offences,41,16
2023/24,1,Lincolnshire,Theft from automatic machine or meter,Theft offences,Other theft offences,47,5
2023/24,1,Lincolnshire,Theft from the person,Theft offences,Theft from the person,39,46
2023/24,1,Lincolnshire,Theft from vehicle,Theft offences,Theft from a vehicle,45,286
2023/24,1,Lincolnshire,Theft in a dwelling other than from an automatic machine or meter,Theft offences,Other theft offences,40,109
2023/24,1,Lincolnshire,Theft of mail,Theft offences,Other theft offences,42,2
2023/24,1,Lincolnshire,Theft or unauthorised taking of a pedal cycle,Theft offences,Bicycle theft,44,185
2023/24,1,Lincolnshire,Theft or unauthorised taking of motor vehicle,Theft offences,Theft of a motor vehicle,48,161
2023/24,1,Lincolnshire,Threat or possession with intent to commit criminal damage,Miscellaneous crimes against society,Miscellaneous crimes against society,59,121
2023/24,1,Lincolnshire,Threats to kill,Violence against the person,Violence without injury,3B,177
2023/24,1,Lincolnshire,Trafficking for sexual exploitation,Sexual offences,Other sexual offences,72,0
2023/24,1,Lincolnshire,Trafficking in controlled drugs,Drug offences,Trafficking of drugs,92A,201
2023/24,1,Lincolnshire,Unnatural sexual offences,Sexual offences,Other sexual offences,88D,1
2023/24,1,Lincolnshire,Violent disorder,Public order offences,Public order offences,62A,1
2023/24,1,Lincolnshire,Wildlife,Miscellaneous crimes against society,Miscellaneous crimes against society,96,1
2023/24,1,"London, City of",Absconding from lawful custody,Miscellaneous crimes against society,Miscellaneous crimes against society,80,0
2023/24,1,"London, City of",Abuse of children through sexual exploitation,Sexual offences,Other sexual offences,71,0
2023/24,1,"London, City of",Abuse of position of trust of a sexual nature,Sexual offences,Other sexual offences,73,2
2023/24,1,"London, City of",Aggravated burglary - residential (home),Theft offences,Domestic burglary,29B,0
2023/24,1,"London, City of",Aggravated burglary - residential (unconnected building),Theft offences,Domestic burglary,29C,0
2023/24,1,"London, City of",Aggravated Burglary Business and Community,Theft offences,Non-domestic burglary,31A,0
2023/24,1,"London, City of",Aggravated burglary in a building other than a dwelling(outcome only),Theft offences,Non-domestic burglary,31,0
2023/24,1,"London, City of",Aggravated burglary in a dwelling (outcome only),Theft offences,Domestic burglary,29,0
2023/24,1,"London, City of",Aggravated Burglary Residential,Theft offences,Domestic burglary,29A,0
2023/24,1,"London, City of",Aggravated vehicle taking,Theft offences,Theft of a motor vehicle,37.2,0
2023/24,1,"London, City of",Aiding suicide,Miscellaneous crimes against society,Miscellaneous crimes against society,76,0
2023/24,1,"London, City of",Arson endangering life,Criminal damage and arson,Arson,56A,0
2023/24,1,"London, City of",Arson not endangering life,Criminal damage and arson,Arson,56B,1
2023/24,1,"London, City of",Assault with injury,Violence against the person,Violence with injury,8N,63
2023/24,1,"London, City of",Assault with injury on a constable,Violence against the person,Violence with injury,8S,3
2023/24,1,"London, City of",Assault with intent to cause serious harm,Violence against the person,Violence with injury,5D,6
2023/24,1,"London, City of",Assault without injury,Violence against the person,Violence without injury,105A,121
2023/24,1,"London, City of",Assault without injury on a constable,Violence against the person,Violence without injury,104,13
2023/24,1,"London, City of",Assaults on emergency workers (other than constables),Violence against the person,Violence with injury,8T,0
2023/24,1,"London, City of",Attempted Burglary Business and Community,Theft offences,Non-domestic burglary,30D,1
2023/24,1,"London, City of",Attempted burglary in a building other than a dwelling (outcome only),Theft offences,Non-domestic burglary,30B,0
2023/24,1,"London, City of",Attempted burglary in a dwelling (outcome only),Theft offences,Domestic burglary,28B,0
2023/24,1,"London, City of",Attempted Burglary Residential,Theft offences,Domestic burglary,28F,0
2023/24,1,"London, City of",Attempted distraction burglary - residential (home),Theft offences,Domestic burglary,28L,0
2023/24,1,"London, City of",Attempted distraction burglary - residential (unconnected building),Theft offences,Domestic burglary,28P,0
2023/24,1,"London, City of",Attempted distraction burglary in a dwelling (outcome only),Theft offences,Domestic burglary,28D,0
2023/24,1,"London, City of",Attempted Distraction Burglary Residential,Theft offences,Domestic burglary,28H,0
2023/24,1,"London, City of",Attempted murder,Violence against the person,Violence with injury,2,0
2023/24,1,"London, City of",Attempted residential burglary of a home,Theft offences,Domestic burglary,28J,1
2023/24,1,"London, City of",Attempted residential burglary of unconnected building,Theft offences,Domestic burglary,28N,1
2023/24,1,"London, City of",Bail offences,Miscellaneous crimes against society,Miscellaneous crimes against society,83,0
2023/24,1,"London, City of",Bigamy,Miscellaneous crimes against society,Miscellaneous crimes against society,26,0
2023/24,1,"London, City of",Blackmail,Theft offences,Other theft offences,35,6
2023/24,1,"London, City of",Burglary Business and Community,Theft offences,Non-domestic burglary,30C,68
2023/24,1,"London, City of",Burglary in a building other than a dwelling (outcome only),Theft offences,Non-domestic burglary,30A,0
2023/24,1,"London, City of",Burglary in a dwelling(outcome only),Theft offences,Domestic burglary,28A,0
2023/24,1,"London, City of",Burglary Residential,Theft offences,Domestic burglary,28E,0
2023/24,1,"London, City of",Causing death by aggravated vehicle taking,Violence against the person,Death or serious injury - unlawful driving,37.1,0
2023/24,1,"London, City of",Causing death by careless driving under influence of drink or drugs,Violence against the person,Death or serious injury - unlawful driving,4.6,0
2023/24,1,"London, City of",Causing death by careless or inconsiderate driving,Violence against the person,Death or serious injury - unlawful driving,4.8,0
2023/24,1,"London, City of",Causing death by driving: unlicensed or disqualified or uninsured drivers,Violence against the person,Death or serious injury - unlawful driving,4.9,0
2023/24,1,"London, City of",Causing death or serious injury by dangerous driving,Violence against the person,Death or serious injury - unlawful driving,4.4,0
2023/24,1,"London, City of",Causing or allowing death of child or vulnerable person,Violence against the person,Violence with injury,4.7,0
2023/24,1,"London, City of",Causing sexual activity without consent,Sexual offences,Other sexual offences,22A,0
2023/24,1,"London, City of",Child abduction,Violence against the person,Violence without injury,13,0
2023/24,1,"London, City of",Concealing an infant death close to birth,Miscellaneous crimes against society,Miscellaneous crimes against society,15,0
2023/24,1,"London, City of",Conspiracy to murder,Violence against the person,Violence without injury,3A,0
2023/24,1,"London, City of",Controlling and coercive behaviour,Violence against the person,Stalking and harassment,8U,6
2023/24,1,"London, City of",Corporate manslaughter,Violence against the person,Homicide,4.10,0
2023/24,1,"London, City of",Criminal damage to a building other than a dwelling,Criminal damage and arson,Criminal damage,58B,26
2023/24,1,"London, City of",Criminal damage to a dwelling,Criminal damage and arson,Criminal damage,58A,2
2023/24,1,"London, City of",Criminal damage to a vehicle,Criminal damage and arson,Criminal damage,58C,8
2023/24,1,"London, City of",Cruelty to children/young persons,Violence against the person,Violence without injury,11A,0
2023/24,1,"London, City of",Dangerous driving,Miscellaneous crimes against society,Miscellaneous crimes against society,802,0
2023/24,1,"London, City of","Disclosure, obstruction, false or misleading statements etc",Miscellaneous crimes against society,Miscellaneous crimes against society,95,0
2023/24,1,"London, City of",Dishonest use of electricity,Theft offences,Other theft offences,43,0
2023/24,1,"London, City of",Distraction burglary - residential (home),Theft offences,Domestic burglary,28K,1
2023/24,1,"London, City of",Distraction burglary - residential (unconnected building),Theft offences,Domestic burglary,28O,0
2023/24,1,"London, City of",Distraction burglary in a dwelling (outcome only),Theft offences,Domestic burglary,28C,0
2023/24,1,"London, City of",Distraction Burglary Residential,Theft offences,Domestic burglary,28G,0
2023/24,1,"London, City of",Endangering life,Violence against the person,Violence with injury,5E,1
2023/24,1,"London, City of",Exploitation of prostitution,Miscellaneous crimes against society,Miscellaneous crimes against society,24,0
2023/24,1,"London, City of",Exposure and voyeurism,Sexual offences,Other sexual offences,88E,1
2023/24,1,"London, City of",Forgery or use of false drug prescription,Miscellaneous crimes against society,Miscellaneous crimes against society,60,0
2023/24,1,"London, City of","Fraud, forgery etc associated with vehicle or driver records",Miscellaneous crimes against society,Miscellaneous crimes against society,814,0
2023/24,1,"London, City of","Going equipped for stealing, etc",Miscellaneous crimes against society,Miscellaneous crimes against society,33,2
2023/24,1,"London, City of",Handling stolen goods,Miscellaneous crimes against society,Miscellaneous crimes against society,54,4
2023/24,1,"London, City of",Harassment,Violence against the person,Stalking and harassment,8L,6
2023/24,1,"London, City of",Incest or familial sexual offences,Sexual offences,Other sexual offences,23,0
2023/24,1,"London, City of",Infanticide,Violence against the person,Homicide,4.2,0
2023/24,1,"London, City of",Intentional destruction of a viable unborn child,Violence against the person,Violence with injury,4.3,0
2023/24,1,"London, City of",Interfering with a motor vehicle,Theft offences,Vehicle interference,126,0
2023/24,1,"London, City of",Kidnapping,Violence against the person,Violence without injury,36,1
2023/24,1,"London, City of",Making off without payment,Theft offences,Other theft offences,49A,4
2023/24,1,"London, City of","Making, supplying or possessing articles for use in fraud",Miscellaneous crimes against society,Miscellaneous crimes against society,33A,4
2023/24,1,"London, City of",Malicious Communications,Violence against the person,Stalking and harassment,8R,15
2023/24,1,"London, City of",Manslaughter,Violence against the person,Homicide,4.1,0
2023/24,1,"London, City of",Modern slavery,Violence against the person,Violence without injury,106,3
2023/24,1,"London, City of",Murder,Violence against the person,Homicide,1,0
2023/24,1,"London, City of",Obscene publications etc,Miscellaneous crimes against society,Miscellaneous crimes against society,86,2
2023/24,1,"London, City of",Offender Management Act offences,Miscellaneous crimes against society,Miscellaneous crimes against society,69,0
2023/24,1,"London, City of",Other criminal damage,Criminal damage and arson,Criminal damage,58D,4
2023/24,1,"London, City of",Other drug offences,Drug offences,Possession of drugs,92C,2
2023/24,1,"London, City of",Other firearms offences,Possession of weapons offences,Possession of weapons offences,81,0
2023/24,1,"London, City of",Other forgery,Miscellaneous crimes against society,Miscellaneous crimes against society,61,0
2023/24,1,"London, City of",Other knives offences,Possession of weapons offences,Possession of weapons offences,90,0
2023/24,1,"London, City of",Other miscellaneous sexual offences,Sexual offences,Other sexual offences,88C,0
2023/24,1,"London, City of",Other notifiable offences,Miscellaneous crimes against society,Miscellaneous crimes against society,99,5
2023/24,1,"London, City of",Other offences against the State or public order,Public order offences,Public order offences,66,9
2023/24,1,"London, City of",Other theft,Theft offences,Other theft offences,49,359
2023/24,1,"London, City of",Perjury,Miscellaneous crimes against society,Miscellaneous crimes against society,67,0
2023/24,1,"London, City of",Perverting the course of justice,Miscellaneous crimes against society,Miscellaneous crimes against society,79,3
2023/24,1,"London, City of",Possession of article with blade or point,Possession of weapons offences,Possession of weapons offences,10D,2
2023/24,1,"London, City of",Possession of controlled drugs (Cannabis),Drug offences,Possession of drugs,92E,70
2023/24,1,"London, City of",Possession of controlled drugs (excl. Cannabis),Drug offences,Possession of drugs,92D,17
2023/24,1,"London, City of",Possession of false documents,Miscellaneous crimes against society,Miscellaneous crimes against society,61A,2
2023/24,1,"London, City of",Possession of firearms offences,Possession of weapons offences,Possession of weapons offences,10B,1
2023/24,1,"London, City of",Possession of firearms with intent,Possession of weapons offences,Possession of weapons offences,10A,1
2023/24,1,"London, City of",Possession of other weapons,Possession of weapons offences,Possession of weapons offences,10C,4
2023/24,1,"London, City of",Procuring illegal abortion,Violence against the person,Violence without injury,14,0
2023/24,1,"London, City of",Profiting from or concealing knowledge of the proceeds of crime,Miscellaneous crimes against society,Miscellaneous crimes against society,38,1
2023/24,1,"London, City of","Public fear, alarm or distress",Public order offences,Public order offences,9A,72
2023/24,1,"London, City of",Racially or religiously aggravated assault with injury,Violence against the person,Violence with injury,8P,3
2023/24,1,"London, City of",Racially or religiously aggravated assault without injury,Violence against the person,Violence without injury,105B,7
2023/24,1,"London, City of",Racially or religiously aggravated criminal damage,Criminal damage and arson,Criminal damage,58J,1
2023/24,1,"London, City of",Racially or religiously aggravated harassment,Violence against the person,Stalking and harassment,8M,1
2023/24,1,"London, City of","Racially or religiously aggravated public fear, alarm or distress",Public order offences,Public order offences,9B,19
2023/24,1,"London, City of",Rape of a Female - Multiple Undefined Offenders,Sexual offences,Rape offences,19J,0
2023/24,1,"London, City of",Rape of a female aged 16 and over,Sexual offences,Rape offences,19C,8
2023/24,1,"London, City of",Rape of a female child under 13,Sexual offences,Rape offences,19E,0
2023/24,1,"London, City of",Rape of a female child under 16,Sexual offences,Rape offences,19D,1
2023/24,1,"London, City of",Rape of a Male - Multiple Undefined Offenders,Sexual offences,Rape offences,19K,0
2023/24,1,"London, City of",Rape of a male aged 16 and over,Sexual offences,Rape offences,19F,0
2023/24,1,"London, City of",Rape of a male child under 13,Sexual offences,Rape offences,19H,0
2023/24,1,"London, City of",Rape of a male child under 16,Sexual offences,Rape offences,19G,0
2023/24,1,"London, City of",Residential burglary of a home,Theft offences,Domestic burglary,28I,1
2023/24,1,"London, City of",Residential burglary of unconnected building,Theft offences,Domestic burglary,28M,0
2023/24,1,"London, City of",Robbery of business property,Robbery,Robbery of business property,34A,3
2023/24,1,"London, City of",Robbery of personal property,Robbery,Robbery of personal property,34B,27
2023/24,1,"London, City of",Sexual activity etc with a person with a mental disorder,Sexual offences,Other sexual offences,70,0
2023/24,1,"London, City of",Sexual activity involving a child under 13,Sexual offences,Other sexual offences,21,0
2023/24,1,"London, City of",Sexual activity involving child under 16,Sexual offences,Other sexual offences,22B,1
2023/24,1,"London, City of",Sexual assault on a female aged 13 and over,Sexual offences,Other sexual offences,20A,21
2023/24,1,"London, City of",Sexual assault on a female child under 13,Sexual offences,Other sexual offences,20B,0
2023/24,1,"London, City of",Sexual assault on a male aged 13 and over,Sexual offences,Other sexual offences,17A,4
2023/24,1,"London, City of",Sexual assault on a male child under 13,Sexual offences,Other sexual offences,17B,0
2023/24,1,"London, City of",Sexual grooming,Sexual offences,Other sexual offences,88A,0
2023/24,1,"London, City of",Shoplifting,Theft offences,Shoplifting,46,140
2023/24,1,"London, City of",Soliciting for the purposes of prostitution,Miscellaneous crimes against society,Miscellaneous crimes against society,27,0
2023/24,1,"London, City of",Stalking,Violence against the person,Stalking and harassment,8Q,2
2023/24,1,"London, City of",Theft by an employee,Theft offences,Other theft offences,41,3
2023/24,1,"London, City of",Theft from automatic machine or meter,Theft offences,Other theft offences,47,1
2023/24,1,"London, City of",Theft from the person,Theft offences,Theft from the person,39,263
2023/24,1,"London, City of",Theft from vehicle,Theft offences,Theft from a vehicle,45,21
2023/24,1,"London, City of",Theft in a dwelling other than from an automatic machine or meter,Theft offences,Other theft offences,40,0
2023/24,1,"London, City of",Theft of mail,Theft offences,Other theft offences,42,4
2023/24,1,"London, City of",Theft or unauthorised taking of a pedal cycle,Theft offences,Bicycle theft,44,44
2023/24,1,"London, City of",Theft or unauthorised taking of motor vehicle,Theft offences,Theft of a motor vehicle,48,6
2023/24,1,"London, City of",Threat or possession with intent to commit criminal damage,Miscellaneous crimes against society,Miscellaneous crimes against society,59,0
2023/24,1,"London, City of",Threats to kill,Violence against the person,Violence without injury,3B,4
2023/24,1,"London, City of",Trafficking for sexual exploitation,Sexual offences,Other sexual offences,72,0
2023/24,1,"London, City of",Trafficking in controlled drugs,Drug offences,Trafficking of drugs,92A,12
2023/24,1,"London, City of",Unnatural sexual offences,Sexual offences,Other sexual offences,88D,0
2023/24,1,"London, City of",Violent disorder,Public order offences,Public order offences,62A,0
2023/24,1,"London, City of",Wildlife,Miscellaneous crimes against society,Miscellaneous crimes against society,96,0
