financialYear,financialQuarter,forceName,offenceDescription,offenceGroup,offenceSubgroup,offenceCode,numberofOffences
2023/24,1,Avon and Somerset,Absconding from lawful custody,Miscellaneous crimes against society,Miscellaneous crimes against society,80,2
2023/24,1,Avon and Somerset,Abuse of children through sexual exploitation,Sexual offences,Other sexual offences,71,3
2023/24,1,Avon and Somerset,Abuse of position of trust of a sexual nature,Sexual offences,Other sexual offences,73,2
2023/24,1,Avon and Somerset,Aggravated burglary - residential (home),Theft offences,Domestic burglary,29B,24
2023/24,1,Avon and Somerset,Aggravated burglary - residential (unconnected building),Theft offences,Domestic burglary,29C,2
2023/24,1,Avon and Somerset,Aggravated Burglary Business and Community,Theft offences,Non-domestic burglary,31A,5
2023/24,1,Avon and Somerset,Aggravated burglary in a building other than a dwelling(outcome only),Theft offences,Non-domestic burglary,31,0
2023/24,1,Avon and Somerset,Aggravated burglary in a dwelling (outcome only),Theft offences,Domestic burglary,29,0
2023/24,1,Avon and Somerset,Aggravated Burglary Residential,Theft offences,Domestic burglary,29A,0
2023/24,1,Avon and Somerset,Aggravated vehicle taking,Theft offences,Theft of a motor vehicle,37.2,4
2023/24,1,Avon and Somerset,Aiding suicide,Miscellaneous crimes against society,Miscellaneous crimes against society,76,0
2023/24,1,Avon and Somerset,Arson endangering life,Criminal damage and arson,Arson,56A,28
2023/24,1,Avon and Somerset,Arson not endangering life,Criminal damage and arson,Arson,56B,180
2023/24,1,Avon and Somerset,Assault with injury,Violence against the person,Violence with injury,8N,3296
2023/24,1,Avon and Somerset,Assault with injury on a constable,Violence against the person,Violence with injury,8S,107
2023/24,1,Avon and Somerset,Assault with intent to cause serious harm,Violence against the person,Violence with injury,5D,139
2023/24,1,Avon and Somerset,Assault without injury,Violence against the person,Violence without injury,105A,4651
2023/24,1,Avon and Somerset,Assault without injury on a constable,Violence against the person,Violence without injury,104,327
2023/24,1,Avon and Somerset,Assaults on emergency workers (other than constables),Violence against the person,Violence with injury,8T,38
2023/24,1,Avon and Somerset,Attempted Burglary Business and Community,Theft offences,Non-domestic burglary,30D,81
2023/24,1,Avon and Somerset,Attempted burglary in a building other than a dwelling (outcome only),Theft offences,Non-domestic burglary,30B,0
2023/24,1,Avon and Somerset,Attempted burglary in a dwelling (outcome only),Theft offences,Domestic burglary,28B,0
2023/24,1,Avon and Somerset,Attempted Burglary Residential,Theft offences,Domestic burglary,28F,0
2023/24,1,Avon and Somerset,Attempted distraction burglary - residential (home),Theft offences,Domestic burglary,28L,0
2023/24,1,Avon and Somerset,Attempted distraction burglary - residential (unconnected building),Theft offences,Domestic burglary,28P,0
2023/24,1,Avon and Somerset,Attempted distraction burglary in a dwelling (outcome only),Theft offences,Domestic burglary,28D,0
2023/24,1,Avon and Somerset,Attempted Distraction Burglary Residential,Theft offences,Domestic burglary,28H,0
2023/24,1,Avon and Somerset,Attempted murder,Violence against the person,Violence with injury,2,3
2023/24,1,Avon and Somerset,Attempted residential burglary of a home,Theft offences,Domestic burglary,28J,112
2023/24,1,Avon and Somerset,Attempted residential burglary of unconnected building,Theft offences,Domestic burglary,28N,49
2023/24,1,Avon and Somerset,Bail offences,Miscellaneous crimes against society,Miscellaneous crimes against society,83,1
2023/24,1,Avon and Somerset,Bigamy,Miscellaneous crimes against society,Miscellaneous crimes against society,26,1
2023/24,1,Avon and Somerset,Blackmail,Theft offences,Other theft offences,35,341
2023/24,1,Avon and Somerset,Burglary Business and Community,Theft offences,Non-domestic burglary,30C,465
2023/24,1,Avon and Somerset,Burglary in a building other than a dwelling (outcome only),Theft offences,Non-domestic burglary,30A,0
2023/24,1,Avon and Somerset,Burglary in a dwelling(outcome only),Theft offences,Domestic burglary,28A,0
2023/24,1,Avon and Somerset,Burglary Residential,Theft offences,Domestic burglary,28E,0
2023/24,1,Avon and Somerset,Causing death by aggravated vehicle taking,Violence against the person,Death or serious injury - unlawful driving,37.1,0
2023/24,1,Avon and Somerset,Causing death by careless driving under influence of drink or drugs,Violence against the person,Death or serious injury - unlawful driving,4.6,0
2023/24,1,Avon and Somerset,Causing death by careless or inconsiderate driving,Violence against the person,Death or serious injury - unlawful driving,4.8,0
2023/24,1,Avon and Somerset,Causing death by driving: unlicensed or disqualified or uninsured drivers,Violence against the person,Death or serious injury - unlawful driving,4.9,0
2023/24,1,Avon and Somerset,Causing death or serious injury by dangerous driving,Violence against the person,Death or serious injury - unlawful driving,4.4,0
2023/24,1,Avon and Somerset,Causing or allowing death of child or vulnerable person,Violence against the person,Violence with injury,4.7,0
2023/24,1,Avon and Somerset,Causing sexual activity without consent,Sexual offences,Other sexual offences,22A,5
2023/24,1,Avon and Somerset,Child abduction,Violence against the person,Violence without injury,13,6
2023/24,1,Avon and Somerset,Concealing an infant death close to birth,Miscellaneous crimes against society,Miscellaneous crimes against society,15,1
2023/24,1,Avon and Somerset,Conspiracy to murder,Violence against the person,Violence without injury,3A,0
2023/24,1,Avon and Somerset,Controlling and coercive behaviour,Violence against the person,Stalking and harassment,8U,321
2023/24,1,Avon and Somerset,Corporate manslaughter,Violence against the person,Homicide,4.10,0
2023/24,1,Avon and Somerset,Criminal damage to a building other than a dwelling,Criminal damage and arson,Criminal damage,58B,416
2023/24,1,Avon and Somerset,Criminal damage to a dwelling,Criminal damage and arson,Criminal damage,58A,744
2023/24,1,Avon and Somerset,Criminal damage to a vehicle,Criminal damage and arson,Criminal damage,58C,1484
2023/24,1,Avon and Somerset,Cruelty to children/young persons,Violence against the person,Violence without injury,11A,320
2023/24,1,Avon and Somerset,Dangerous driving,Miscellaneous crimes against society,Miscellaneous crimes against society,802,11
2023/24,1,Avon and Somerset,"Disclosure, obstruction, false or misleading statements etc",Miscellaneous crimes against society,Miscellaneous crimes against society,95,2
2023/24,1,Avon and Somerset,Dishonest use of electricity,Theft offences,Other theft offences,43,2
2023/24,1,Avon and Somerset,Distraction burglary - residential (home),Theft offences,Domestic burglary,28K,4
2023/24,1,Avon and Somerset,Distraction burglary - residential (unconnected building),Theft offences,Domestic burglary,28O,0
2023/24,1,Avon and Somerset,Distraction burglary in a dwelling (outcome only),Theft offences,Domestic burglary,28C,0
2023/24,1,Avon and Somerset,Distraction Burglary Residential,Theft offences,Domestic burglary,28G,0
2023/24,1,Avon and Somerset,Endangering life,Violence against the person,Violence with injury,5E,8
2023/24,1,Avon and Somerset,Exploitation of prostitution,Miscellaneous crimes against society,Miscellaneous crimes against society,24,3
2023/24,1,Avon and Somerset,Exposure and voyeurism,Sexual offences,Other sexual offences,88E,116
2023/24,1,Avon and Somerset,Forgery or use of false drug prescription,Miscellaneous crimes against society,Miscellaneous crimes against society,60,0
2023/24,1,Avon and Somerset,"Fraud, forgery etc associated with vehicle or driver records",Miscellaneous crimes against society,Miscellaneous crimes against society,814,3
2023/24,1,Avon and Somerset,"Going equipped for stealing, etc",Miscellaneous crimes against society,Miscellaneous crimes against society,33,12
2023/24,1,Avon and Somerset,Handling stolen goods,Miscellaneous crimes against society,Miscellaneous crimes against society,54,4
2023/24,1,Avon and Somerset,Harassment,Violence against the person,Stalking and harassment,8L,1643
2023/24,1,Avon and Somerset,Incest or familial sexual offences,Sexual offences,Other sexual offences,23,21
2023/24,1,Avon and Somerset,Infanticide,Violence against the person,Homicide,4.2,0
2023/24,1,Avon and Somerset,Intentional destruction of a viable unborn child,Violence against the person,Violence with injury,4.3,0
2023/24,1,Avon and Somerset,Interfering with a motor vehicle,Theft offences,Vehicle interference,126,245
2023/24,1,Avon and Somerset,Kidnapping,Violence against the person,Violence without injury,36,40
2023/24,1,Avon and Somerset,Making off without payment,Theft offences,Other theft offences,49A,284
2023/24,1,Avon and Somerset,"Making, supplying or possessing articles for use in fraud",Miscellaneous crimes against society,Miscellaneous crimes against society,33A,1
2023/24,1,Avon and Somerset,Malicious Communications,Violence against the person,Stalking and harassment,8R,1478
2023/24,1,Avon and Somerset,Manslaughter,Violence against the person,Homicide,4.1,0
2023/24,1,Avon and Somerset,Modern slavery,Violence against the person,Violence without injury,106,56
2023/24,1,Avon and Somerset,Murder,Violence against the person,Homicide,1,4
2023/24,1,Avon and Somerset,Obscene publications etc,Miscellaneous crimes against society,Miscellaneous crimes against society,86,237
2023/24,1,Avon and Somerset,Offender Management Act offences,Miscellaneous crimes against society,Miscellaneous crimes against society,69,23
2023/24,1,Avon and Somerset,Other criminal damage,Criminal damage and arson,Criminal damage,58D,995
2023/24,1,Avon and Somerset,Other drug offences,Drug offences,Possession of drugs,92C,2
2023/24,1,Avon and Somerset,Other firearms offences,Possession of weapons offences,Possession of weapons offences,81,8
2023/24,1,Avon and Somerset,Other forgery,Miscellaneous crimes against society,Miscellaneous crimes against society,61,23
2023/24,1,Avon and Somerset,Other knives offences,Possession of weapons offences,Possession of weapons offences,90,0
2023/24,1,Avon and Somerset,Other miscellaneous sexual offences,Sexual offences,Other sexual offences,88C,5
2023/24,1,Avon and Somerset,Other notifiable offences,Miscellaneous crimes against society,Miscellaneous crimes against society,99,34
2023/24,1,Avon and Somerset,Other offences against the State or public order,Public order offences,Public order offences,66,763
2023/24,1,Avon and Somerset,Other theft,Theft offences,Other theft offences,49,2158
2023/24,1,Avon and Somerset,Perjury,Miscellaneous crimes against society,Miscellaneous crimes against society,67,0
2023/24,1,Avon and Somerset,Perverting the course of justice,Miscellaneous crimes against society,Miscellaneous crimes against society,79,34
2023/24,1,Avon and Somerset,Possession of article with blade or point,Possession of weapons offences,Possession of weapons offences,10D,153
2023/24,1,Avon and Somerset,Possession of controlled drugs (Cannabis),Drug offences,Possession of drugs,92E,435
2023/24,1,Avon and Somerset,Possession of controlled drugs (excl. Cannabis),Drug offences,Possession of drugs,92D,120
2023/24,1,Avon and Somerset,Possession of false documents,Miscellaneous crimes against society,Miscellaneous crimes against society,61A,0
2023/24,1,Avon and Somerset,Possession of firearms offences,Possession of weapons offences,Possession of weapons offences,10B,8
2023/24,1,Avon and Somerset,Possession of firearms with intent,Possession of weapons offences,Possession of weapons offences,10A,14
2023/24,1,Avon and Somerset,Possession of other weapons,Possession of weapons offences,Possession of weapons offences,10C,96
2023/24,1,Avon and Somerset,Procuring illegal abortion,Violence against the person,Violence without injury,14,0
2023/24,1,Avon and Somerset,Profiting from or concealing knowledge of the proceeds of crime,Miscellaneous crimes against society,Miscellaneous crimes against society,38,4
2023/24,1,Avon and Somerset,"Public fear, alarm or distress",Public order offences,Public order offences,9A,3384
2023/24,1,Avon and Somerset,Racially or religiously aggravated assault with injury,Violence against the person,Violence with injury,8P,17
2023/24,1,Avon and Somerset,Racially or religiously aggravated assault without injury,Violence against the person,Violence without injury,105B,81
2023/24,1,Avon and Somerset,Racially or religiously aggravated criminal damage,Criminal damage and arson,Criminal damage,58J,11
2023/24,1,Avon and Somerset,Racially or religiously aggravated harassment,Violence against the person,Stalking and harassment,8M,48
2023/24,1,Avon and Somerset,"Racially or religiously aggravated public fear, alarm or distress",Public order offences,Public order offences,9B,409
2023/24,1,Avon and Somerset,Rape of a Female - Multiple Undefined Offenders,Sexual offences,Rape offences,19J,17
2023/24,1,Avon and Somerset,Rape of a female aged 16 and over,Sexual offences,Rape offences,19C,368
2023/24,1,Avon and Somerset,Rape of a female child under 13,Sexual offences,Rape offences,19E,38
2023/24,1,Avon and Somerset,Rape of a female child under 16,Sexual offences,Rape offences,19D,72
2023/24,1,Avon and Somerset,Rape of a Male - Multiple Undefined Offenders,Sexual offences,Rape offences,19K,1
2023/24,1,Avon and Somerset,Rape of a male aged 16 and over,Sexual offences,Rape offences,19F,30
2023/24,1,Avon and Somerset,Rape of a male child under 13,Sexual offences,Rape offences,19H,13
2023/24,1,Avon and Somerset,Rape of a male child under 16,Sexual offences,Rape offences,19G,14
2023/24,1,Avon and Somerset,Residential burglary of a home,Theft offences,Domestic burglary,28I,403
2023/24,1,Avon and Somerset,Residential burglary of unconnected building,Theft offences,Domestic burglary,28M,300
2023/24,1,Avon and Somerset,Robbery of business property,Robbery,Robbery of business property,34A,140
2023/24,1,Avon and Somerset,Robbery of personal property,Robbery,Robbery of personal property,34B,376
2023/24,1,Avon and Somerset,Sexual activity etc with a person with a mental disorder,Sexual offences,Other sexual offences,70,2
2023/24,1,Avon and Somerset,Sexual activity involving a child under 13,Sexual offences,Other sexual offences,21,25
2023/24,1,Avon and Somerset,Sexual activity involving child under 16,Sexual offences,Other sexual offences,22B,47
2023/24,1,Avon and Somerset,Sexual assault on a female aged 13 and over,Sexual offences,Other sexual offences,20A,403
2023/24,1,Avon and Somerset,Sexual assault on a female child under 13,Sexual offences,Other sexual offences,20B,79
2023/24,1,Avon and Somerset,Sexual assault on a male aged 13 and over,Sexual offences,Other sexual offences,17A,55
2023/24,1,Avon and Somerset,Sexual assault on a male child under 13,Sexual offences,Other sexual offences,17B,33
2023/24,1,Avon and Somerset,Sexual grooming,Sexual offences,Other sexual offences,88A,71
2023/24,1,Avon and Somerset,Shoplifting,Theft offences,Shoplifting,46,3534
2023/24,1,Avon and Somerset,Soliciting for the purposes of prostitution,Miscellaneous crimes against society,Miscellaneous crimes against society,27,12
2023/24,1,Avon and Somerset,Stalking,Violence against the person,Stalking and harassment,8Q,940
2023/24,1,Avon and Somerset,Theft by an employee,Theft offences,Other theft offences,41,25
2023/24,1,Avon and Somerset,Theft from automatic machine or meter,Theft offences,Other theft offences,47,12
2023/24,1,Avon and Somerset,Theft from the person,Theft offences,Theft from the person,39,238
2023/24,1,Avon and Somerset,Theft from vehicle,Theft offences,Theft from a vehicle,45,1369
2023/24,1,Avon and Somerset,Theft in a dwelling other than from an automatic machine or meter,Theft offences,Other theft offences,40,178
2023/24,1,Avon and Somerset,Theft of mail,Theft offences,Other theft offences,42,56
2023/24,1,Avon and Somerset,Theft or unauthorised taking of a pedal cycle,Theft offences,Bicycle theft,44,515
2023/24,1,Avon and Somerset,Theft or unauthorised taking of motor vehicle,Theft offences,Theft of a motor vehicle,48,786
2023/24,1,Avon and Somerset,Threat or possession with intent to commit criminal damage,Miscellaneous crimes against society,Miscellaneous crimes against society,59,181
2023/24,1,Avon and Somerset,Threats to kill,Violence against the person,Violence without injury,3B,314
2023/24,1,Avon and Somerset,Trafficking for sexual exploitation,Sexual offences,Other sexual offences,72,0
2023/24,1,Avon and Somerset,Trafficking in controlled drugs,Drug offences,Trafficking of drugs,92A,106
2023/24,1,Avon and Somerset,Unnatural sexual offences,Sexual offences,Other sexual offences,88D,0
2023/24,1,Avon and Somerset,Violent disorder,Public order offences,Public order offences,62A,12
2023/24,1,Avon and Somerset,Wildlife,Miscellaneous crimes against society,Miscellaneous crimes against society,96,0
2023/24,1,Bedfordshire,Absconding from lawful custody,Miscellaneous crimes against society,Miscellaneous crimes against society,80,1
2023/24,1,Bedfordshire,Abuse of children through sexual exploitation,Sexual offences,Other sexual offences,71,0
2023/24,1,Bedfordshire,Abuse of position of trust of a sexual nature,Sexual offences,Other sexual offences,73,0
2023/24,1,Bedfordshire,Aggravated burglary - residential (home),Theft offences,Domestic burglary,29B,10
2023/24,1,Bedfordshire,Aggravated burglary - residential (unconnected building),Theft offences,Domestic burglary,29C,0
2023/24,1,Bedfordshire,Aggravated Burglary Business and Community,Theft offences,Non-domestic burglary,31A,1
2023/24,1,Bedfordshire,Aggravated burglary in a building other than a dwelling(outcome only),Theft offences,Non-domestic burglary,31,0
2023/24,1,Bedfordshire,Aggravated burglary in a dwelling (outcome only),Theft offences,Domestic burglary,29,0
2023/24,1,Bedfordshire,Aggravated Burglary Residential,Theft offences,Domestic burglary,29A,0
2023/24,1,Bedfordshire,Aggravated vehicle taking,Theft offences,Theft of a motor vehicle,37.2,12
2023/24,1,Bedfordshire,Aiding suicide,Miscellaneous crimes against society,Miscellaneous crimes against society,76,0
2023/24,1,Bedfordshire,Arson endangering life,Criminal damage and arson,Arson,56A,7
2023/24,1,Bedfordshire,Arson not endangering life,Criminal damage and arson,Arson,56B,49
2023/24,1,Bedfordshire,Assault with injury,Violence against the person,Violence with injury,8N,1152
2023/24,1,Bedfordshire,Assault with injury on a constable,Violence against the person,Violence with injury,8S,17
2023/24,1,Bedfordshire,Assault with intent to cause serious harm,Violence against the person,Violence with injury,5D,85
2023/24,1,Bedfordshire,Assault without injury,Violence against the person,Violence without injury,105A,1685
2023/24,1,Bedfordshire,Assault without injury on a constable,Violence against the person,Violence without injury,104,103
2023/24,1,Bedfordshire,Assaults on emergency workers (other than constables),Violence against the person,Violence with injury,8T,5
2023/24,1,Bedfordshire,Attempted Burglary Business and Community,Theft offences,Non-domestic burglary,30D,15
2023/24,1,Bedfordshire,Attempted burglary in a building other than a dwelling (outcome only),Theft offences,Non-domestic burglary,30B,0
2023/24,1,Bedfordshire,Attempted burglary in a dwelling (outcome only),Theft offences,Domestic burglary,28B,0
2023/24,1,Bedfordshire,Attempted Burglary Residential,Theft offences,Domestic burglary,28F,0
2023/24,1,Bedfordshire,Attempted distraction burglary - residential (home),Theft offences,Domestic burglary,28L,0
2023/24,1,Bedfordshire,Attempted distraction burglary - residential (unconnected building),Theft offences,Domestic burglary,28P,0
2023/24,1,Bedfordshire,Attempted distraction burglary in a dwelling (outcome only),Theft offences,Domestic burglary,28D,0
2023/24,1,Bedfordshire,Attempted Distraction Burglary Residential,Theft offences,Domestic burglary,28H,0
2023/24,1,Bedfordshire,Attempted murder,Violence against the person,Violence with injury,2,6
2023/24,1,Bedfordshire,Attempted residential burglary of a home,Theft offences,Domestic burglary,28J,56
2023/24,1,Bedfordshire,Attempted residential burglary of unconnected building,Theft offences,Domestic burglary,28N,10
2023/24,1,Bedfordshire,Bail offences,Miscellaneous crimes against society,Miscellaneous crimes against society,83,0
2023/24,1,Bedfordshire,Bigamy,Miscellaneous crimes against society,Miscellaneous crimes against society,26,1
2023/24,1,Bedfordshire,Blackmail,Theft offences,Other theft offences,35,115
2023/24,1,Bedfordshire,Burglary Business and Community,Theft offences,Non-domestic burglary,30C,177
2023/24,1,Bedfordshire,Burglary in a building other than a dwelling (outcome only),Theft offences,Non-domestic burglary,30A,0
2023/24,1,Bedfordshire,Burglary in a dwelling(outcome only),Theft offences,Domestic burglary,28A,0
2023/24,1,Bedfordshire,Burglary Residential,Theft offences,Domestic burglary,28E,0
2023/24,1,Bedfordshire,Causing death by aggravated vehicle taking,Violence against the person,Death or serious injury - unlawful driving,37.1,0
2023/24,1,Bedfordshire,Causing death by careless driving under influence of drink or drugs,Violence against the person,Death or serious injury - unlawful driving,4.6,0
2023/24,1,Bedfordshire,Causing death by careless or inconsiderate driving,Violence against the person,Death or serious injury - unlawful driving,4.8,15
2023/24,1,Bedfordshire,Causing death by driving: unlicensed or disqualified or uninsured drivers,Violence against the person,Death or serious injury - unlawful driving,4.9,0
2023/24,1,Bedfordshire,Causing death or serious injury by dangerous driving,Violence against the person,Death or serious injury - unlawful driving,4.4,4
2023/24,1,Bedfordshire,Causing or allowing death of child or vulnerable person,Violence against the person,Violence with injury,4.7,0
2023/24,1,Bedfordshire,Causing sexual activity without consent,Sexual offences,Other sexual offences,22A,1
2023/24,1,Bedfordshire,Child abduction,Violence against the person,Violence without injury,13,2
2023/24,1,Bedfordshire,Concealing an infant death close to birth,Miscellaneous crimes against society,Miscellaneous crimes against society,15,0
2023/24,1,Bedfordshire,Conspiracy to murder,Violence against the person,Violence without injury,3A,1
2023/24,1,Bedfordshire,Controlling and coercive behaviour,Violence against the person,Stalking and harassment,8U,79
2023/24,1,Bedfordshire,Corporate manslaughter,Violence against the person,Homicide,4.10,0
2023/24,1,Bedfordshire,Criminal damage to a building other than a dwelling,Criminal damage and arson,Criminal damage,58B,127
2023/24,1,Bedfordshire,Criminal damage to a dwelling,Criminal damage and arson,Criminal damage,58A,298
2023/24,1,Bedfordshire,Criminal damage to a vehicle,Criminal damage and arson,Criminal damage,58C,354
2023/24,1,Bedfordshire,Cruelty to children/young persons,Violence against the person,Violence without injury,11A,13
2023/24,1,Bedfordshire,Dangerous driving,Miscellaneous crimes against society,Miscellaneous crimes against society,802,8
2023/24,1,Bedfordshire,"Disclosure, obstruction, false or misleading statements etc",Miscellaneous crimes against society,Miscellaneous crimes against society,95,0
2023/24,1,Bedfordshire,Dishonest use of electricity,Theft offences,Other theft offences,43,0
2023/24,1,Bedfordshire,Distraction burglary - residential (home),Theft offences,Domestic burglary,28K,1
2023/24,1,Bedfordshire,Distraction burglary - residential (unconnected building),Theft offences,Domestic burglary,28O,0
2023/24,1,Bedfordshire,Distraction burglary in a dwelling (outcome only),Theft offences,Domestic burglary,28C,0
2023/24,1,Bedfordshire,Distraction Burglary Residential,Theft offences,Domestic burglary,28G,0
2023/24,1,Bedfordshire,Endangering life,Violence against the person,Violence with injury,5E,2
2023/24,1,Bedfordshire,Exploitation of prostitution,Miscellaneous crimes against society,Miscellaneous crimes against society,24,0
2023/24,1,Bedfordshire,Exposure and voyeurism,Sexual offences,Other sexual offences,88E,26
2023/24,1,Bedfordshire,Forgery or use of false drug prescription,Miscellaneous crimes against society,Miscellaneous crimes against society,60,0
2023/24,1,Bedfordshire,"Fraud, forgery etc associated with vehicle or driver records",Miscellaneous crimes against society,Miscellaneous crimes against society,814,3
2023/24,1,Bedfordshire,"Going equipped for stealing, etc",Miscellaneous crimes against society,Miscellaneous crimes against society,33,10
2023/24,1,Bedfordshire,Handling stolen goods,Miscellaneous crimes against society,Miscellaneous crimes against society,54,8
2023/24,1,Bedfordshire,Harassment,Violence against the person,Stalking and harassment,8L,423
2023/24,1,Bedfordshire,Incest or familial sexual offences,Sexual offences,Other sexual offences,23,3
2023/24,1,Bedfordshire,Infanticide,Violence against the person,Homicide,4.2,0
2023/24,1,Bedfordshire,Intentional destruction of a viable unborn child,Violence against the person,Violence with injury,4.3,0
2023/24,1,Bedfordshire,Interfering with a motor vehicle,Theft offences,Vehicle interference,126,151
2023/24,1,Bedfordshire,Kidnapping,Violence against the person,Violence without injury,36,23
2023/24,1,Bedfordshire,Making off without payment,Theft offences,Other theft offences,49A,195
2023/24,1,Bedfordshire,"Making, supplying or possessing articles for use in fraud",Miscellaneous crimes against society,Miscellaneous crimes against society,33A,3
2023/24,1,Bedfordshire,Malicious Communications,Violence against the person,Stalking and harassment,8R,484
2023/24,1,Bedfordshire,Manslaughter,Violence against the person,Homicide,4.1,0
2023/24,1,Bedfordshire,Modern slavery,Violence against the person,Violence without injury,106,9
