financialYear,financialQuarter,forceName,offenceDescription,offenceGroup,offenceSubgroup,offenceCode,numberofOffences
2023/24,1,Nottinghamshire,Sexual grooming,Sexual offences,Other sexual offences,88A,55
2023/24,1,Nottinghamshire,Shoplifting,Theft offences,Shoplifting,46,4155
2023/24,1,Nottinghamshire,Soliciting for the purposes of prostitution,Miscellaneous crimes against society,Miscellaneous crimes against society,27,0
2023/24,1,Nottinghamshire,Stalking,Violence against the person,Stalking and harassment,8Q,295
2023/24,1,Nottinghamshire,Theft by an employee,Theft offences,Other theft offences,41,16
2023/24,1,Nottinghamshire,Theft from automatic machine or meter,Theft offences,Other theft offences,47,3
2023/24,1,Nottinghamshire,Theft from the person,Theft offences,Theft from the person,39,251
2023/24,1,Nottinghamshire,Theft from vehicle,Theft offences,Theft from a vehicle,45,761
2023/24,1,Nottinghamshire,Theft in a dwelling other than from an automatic machine or meter,Theft offences,Other theft offences,40,138
2023/24,1,Nottinghamshire,Theft of mail,Theft offences,Other theft offences,42,12
2023/24,1,Nottinghamshire,Theft or unauthorised taking of a pedal cycle,Theft offences,Bicycle theft,44,353
2023/24,1,Nottinghamshire,Theft or unauthorised taking of motor vehicle,Theft offences,Theft of a motor vehicle,48,502
2023/24,1,Nottinghamshire,Threat or possession with intent to commit criminal damage,Miscellaneous crimes against society,Miscellaneous crimes against society,59,310
2023/24,1,Nottinghamshire,Threats to kill,Violence against the person,Violence without injury,3B,346
2023/24,1,Nottinghamshire,Trafficking for sexual exploitation,Sexual offences,Other sexual offences,72,0
2023/24,1,Nottinghamshire,Trafficking in controlled drugs,Drug offences,Trafficking of drugs,92A,301
2023/24,1,Nottinghamshire,Unnatural sexual offences,Sexual offences,Other sexual offences,88D,0
2023/24,1,Nottinghamshire,Violent disorder,Public order offences,Public order offences,62A,3
2023/24,1,Nottinghamshire,Wildlife,Miscellaneous crimes against society,Miscellaneous crimes against society,96,1
2023/24,1,South Wales,Absconding from lawful custody,Miscellaneous crimes against society,Miscellaneous crimes against society,80,5
2023/24,1,South Wales,Abuse of children through sexual exploitation,Sexual offences,Other sexual offences,71,2
2023/24,1,South Wales,Abuse of position of trust of a sexual nature,Sexual offences,Other sexual offences,73,0
2023/24,1,South Wales,Aggravated burglary - residential (home),Theft offences,Domestic burglary,29B,9
2023/24,1,South Wales,Aggravated burglary - residential (unconnected building),Theft offences,Domestic burglary,29C,2
2023/24,1,South Wales,Aggravated Burglary Business and Community,Theft offences,Non-domestic burglary,31A,1
2023/24,1,South Wales,Aggravated burglary in a building other than a dwelling(outcome only),Theft offences,Non-domestic burglary,31,0
2023/24,1,South Wales,Aggravated burglary in a dwelling (outcome only),Theft offences,Domestic burglary,29,0
2023/24,1,South Wales,Aggravated Burglary Residential,Theft offences,Domestic burglary,29A,2
2023/24,1,South Wales,Aggravated vehicle taking,Theft offences,Theft of a motor vehicle,37.2,22
2023/24,1,South Wales,Aiding suicide,Miscellaneous crimes against society,Miscellaneous crimes against society,76,0
2023/24,1,South Wales,Arson endangering life,Criminal damage and arson,Arson,56A,14
2023/24,1,South Wales,Arson not endangering life,Criminal damage and arson,Arson,56B,98
2023/24,1,South Wales,Assault with injury,Violence against the person,Violence with injury,8N,2845
2023/24,1,South Wales,Assault with injury on a constable,Violence against the person,Violence with injury,8S,67
2023/24,1,South Wales,Assault with intent to cause serious harm,Violence against the person,Violence with injury,5D,267
2023/24,1,South Wales,Assault without injury,Violence against the person,Violence without injury,105A,3210
2023/24,1,South Wales,Assault without injury on a constable,Violence against the person,Violence without injury,104,151
2023/24,1,South Wales,Assaults on emergency workers (other than constables),Violence against the person,Violence with injury,8T,30
2023/24,1,South Wales,Attempted Burglary Business and Community,Theft offences,Non-domestic burglary,30D,54
2023/24,1,South Wales,Attempted burglary in a building other than a dwelling (outcome only),Theft offences,Non-domestic burglary,30B,0
2023/24,1,South Wales,Attempted burglary in a dwelling (outcome only),Theft offences,Domestic burglary,28B,0
2023/24,1,South Wales,Attempted Burglary Residential,Theft offences,Domestic burglary,28F,20
2023/24,1,South Wales,Attempted distraction burglary - residential (home),Theft offences,Domestic burglary,28L,0
2023/24,1,South Wales,Attempted distraction burglary - residential (unconnected building),Theft offences,Domestic burglary,28P,0
2023/24,1,South Wales,Attempted distraction burglary in a dwelling (outcome only),Theft offences,Domestic burglary,28D,0
2023/24,1,South Wales,Attempted Distraction Burglary Residential,Theft offences,Domestic burglary,28H,0
2023/24,1,South Wales,Attempted murder,Violence against the person,Violence with injury,2,2
2023/24,1,South Wales,Attempted residential burglary of a home,Theft offences,Domestic burglary,28J,105
2023/24,1,South Wales,Attempted residential burglary of unconnected building,Theft offences,Domestic burglary,28N,0
2023/24,1,South Wales,Bail offences,Miscellaneous crimes against society,Miscellaneous crimes against society,83,0
2023/24,1,South Wales,Bigamy,Miscellaneous crimes against society,Miscellaneous crimes against society,26,0
2023/24,1,South Wales,Blackmail,Theft offences,Other theft offences,35,241
2023/24,1,South Wales,Burglary Business and Community,Theft offences,Non-domestic burglary,30C,345
2023/24,1,South Wales,Burglary in a building other than a dwelling (outcome only),Theft offences,Non-domestic burglary,30A,0
2023/24,1,South Wales,Burglary in a dwelling(outcome only),Theft offences,Domestic burglary,28A,0
2023/24,1,South Wales,Burglary Residential,Theft offences,Domestic burglary,28E,57
2023/24,1,South Wales,Causing death by aggravated vehicle taking,Violence against the person,Death or serious injury - unlawful driving,37.1,0
2023/24,1,South Wales,Causing death by careless driving under influence of drink or drugs,Violence against the person,Death or serious injury - unlawful driving,4.6,0
2023/24,1,South Wales,Causing death by careless or inconsiderate driving,Violence against the person,Death or serious injury - unlawful driving,4.8,1
2023/24,1,South Wales,Causing death by driving: unlicensed or disqualified or uninsured drivers,Violence against the person,Death or serious injury - unlawful driving,4.9,0
2023/24,1,South Wales,Causing death or serious injury by dangerous driving,Violence against the person,Death or serious injury - unlawful driving,4.4,3
2023/24,1,South Wales,Causing or allowing death of child or vulnerable person,Violence against the person,Violence with injury,4.7,1
2023/24,1,South Wales,Causing sexual activity without consent,Sexual offences,Other sexual offences,22A,3
2023/24,1,South Wales,Child abduction,Violence against the person,Violence without injury,13,2
2023/24,1,South Wales,Concealing an infant death close to birth,Miscellaneous crimes against society,Miscellaneous crimes against society,15,0
2023/24,1,South Wales,Conspiracy to murder,Violence against the person,Violence without injury,3A,1
2023/24,1,South Wales,Controlling and coercive behaviour,Violence against the person,Stalking and harassment,8U,165
2023/24,1,South Wales,Corporate manslaughter,Violence against the person,Homicide,4.10,0
2023/24,1,South Wales,Criminal damage to a building other than a dwelling,Criminal damage and arson,Criminal damage,58B,523
2023/24,1,South Wales,Criminal damage to a dwelling,Criminal damage and arson,Criminal damage,58A,914
2023/24,1,South Wales,Criminal damage to a vehicle,Criminal damage and arson,Criminal damage,58C,1018
2023/24,1,South Wales,Cruelty to children/young persons,Violence against the person,Violence without injury,11A,18
2023/24,1,South Wales,Dangerous driving,Miscellaneous crimes against society,Miscellaneous crimes against society,802,28
2023/24,1,South Wales,"Disclosure, obstruction, false or misleading statements etc",Miscellaneous crimes against society,Miscellaneous crimes against society,95,6
2023/24,1,South Wales,Dishonest use of electricity,Theft offences,Other theft offences,43,11
2023/24,1,South Wales,Distraction burglary - residential (home),Theft offences,Domestic burglary,28K,2
2023/24,1,South Wales,Distraction burglary - residential (unconnected building),Theft offences,Domestic burglary,28O,0
2023/24,1,South Wales,Distraction burglary in a dwelling (outcome only),Theft offences,Domestic burglary,28C,0
2023/24,1,South Wales,Distraction Burglary Residential,Theft offences,Domestic burglary,28G,0
2023/24,1,South Wales,Endangering life,Violence against the person,Violence with injury,5E,5
2023/24,1,South Wales,Exploitation of prostitution,Miscellaneous crimes against society,Miscellaneous crimes against society,24,1
2023/24,1,South Wales,Exposure and voyeurism,Sexual offences,Other sexual offences,88E,105
2023/24,1,South Wales,Forgery or use of false drug prescription,Miscellaneous crimes against society,Miscellaneous crimes against society,60,2
2023/24,1,South Wales,"Fraud, forgery etc associated with vehicle or driver records",Miscellaneous crimes against society,Miscellaneous crimes against society,814,3
2023/24,1,South Wales,"Going equipped for stealing, etc",Miscellaneous crimes against society,Miscellaneous crimes against society,33,12
2023/24,1,South Wales,Handling stolen goods,Miscellaneous crimes against society,Miscellaneous crimes against society,54,8
2023/24,1,South Wales,Harassment,Violence against the person,Stalking and harassment,8L,1125
2023/24,1,South Wales,Incest or familial sexual offences,Sexual offences,Other sexual offences,23,2
2023/24,1,South Wales,Infanticide,Violence against the person,Homicide,4.2,0
2023/24,1,South Wales,Intentional destruction of a viable unborn child,Violence against the person,Violence with injury,4.3,0
2023/24,1,South Wales,Interfering with a motor vehicle,Theft offences,Vehicle interference,126,176
2023/24,1,South Wales,Kidnapping,Violence against the person,Violence without injury,36,21
2023/24,1,South Wales,Making off without payment,Theft offences,Other theft offences,49A,208
2023/24,1,South Wales,"Making, supplying or possessing articles for use in fraud",Miscellaneous crimes against society,Miscellaneous crimes against society,33A,13
2023/24,1,South Wales,Malicious Communications,Violence against the person,Stalking and harassment,8R,1875
2023/24,1,South Wales,Manslaughter,Violence against the person,Homicide,4.1,0
2023/24,1,South Wales,Modern slavery,Violence against the person,Violence without injury,106,44
2023/24,1,South Wales,Murder,Violence against the person,Homicide,1,3
2023/24,1,South Wales,Obscene publications etc,Miscellaneous crimes against society,Miscellaneous crimes against society,86,231
2023/24,1,South Wales,Offender Management Act offences,Miscellaneous crimes against society,Miscellaneous crimes against society,69,30
2023/24,1,South Wales,Other criminal damage,Criminal damage and arson,Criminal damage,58D,515
2023/24,1,South Wales,Other drug offences,Drug offences,Possession of drugs,92C,11
2023/24,1,South Wales,Other firearms offences,Possession of weapons offences,Possession of weapons offences,81,3
2023/24,1,South Wales,Other forgery,Miscellaneous crimes against society,Miscellaneous crimes against society,61,21
2023/24,1,South Wales,Other knives offences,Possession of weapons offences,Possession of weapons offences,90,0
2023/24,1,South Wales,Other miscellaneous sexual offences,Sexual offences,Other sexual offences,88C,3
2023/24,1,South Wales,Other notifiable offences,Miscellaneous crimes against society,Miscellaneous crimes against society,99,13
2023/24,1,South Wales,Other offences against the State or public order,Public order offences,Public order offences,66,198
2023/24,1,South Wales,Other theft,Theft offences,Other theft offences,49,1361
2023/24,1,South Wales,Perjury,Miscellaneous crimes against society,Miscellaneous crimes against society,67,0
2023/24,1,South Wales,Perverting the course of justice,Miscellaneous crimes against society,Miscellaneous crimes against society,79,26
2023/24,1,South Wales,Possession of article with blade or point,Possession of weapons offences,Possession of weapons offences,10D,113
2023/24,1,South Wales,Possession of controlled drugs (Cannabis),Drug offences,Possession of drugs,92E,318
2023/24,1,South Wales,Possession of controlled drugs (excl. Cannabis),Drug offences,Possession of drugs,92D,207
2023/24,1,South Wales,Possession of false documents,Miscellaneous crimes against society,Miscellaneous crimes against society,61A,0
2023/24,1,South Wales,Possession of firearms offences,Possession of weapons offences,Possession of weapons offences,10B,11
2023/24,1,South Wales,Possession of firearms with intent,Possession of weapons offences,Possession of weapons offences,10A,10
2023/24,1,South Wales,Possession of other weapons,Possession of weapons offences,Possession of weapons offences,10C,89
2023/24,1,South Wales,Procuring illegal abortion,Violence against the person,Violence without injury,14,0
2023/24,1,South Wales,Profiting from or concealing knowledge of the proceeds of crime,Miscellaneous crimes against society,Miscellaneous crimes against society,38,12
2023/24,1,South Wales,"Public fear, alarm or distress",Public order offences,Public order offences,9A,3496
2023/24,1,South Wales,Racially or religiously aggravated assault with injury,Violence against the person,Violence with injury,8P,9
2023/24,1,South Wales,Racially or religiously aggravated assault without injury,Violence against the person,Violence without injury,105B,34
2023/24,1,South Wales,Racially or religiously aggravated criminal damage,Criminal damage and arson,Criminal damage,58J,13
2023/24,1,South Wales,Racially or religiously aggravated harassment,Violence against the person,Stalking and harassment,8M,17
2023/24,1,South Wales,"Racially or religiously aggravated public fear, alarm or distress",Public order offences,Public order offences,9B,243
2023/24,1,South Wales,Rape of a Female - Multiple Undefined Offenders,Sexual offences,Rape offences,19J,0
2023/24,1,South Wales,Rape of a female aged 16 and over,Sexual offences,Rape offences,19C,164
2023/24,1,South Wales,Rape of a female child under 13,Sexual offences,Rape offences,19E,15
2023/24,1,South Wales,Rape of a female child under 16,Sexual offences,Rape offences,19D,37
2023/24,1,South Wales,Rape of a Male - Multiple Undefined Offenders,Sexual offences,Rape offences,19K,0
2023/24,1,South Wales,Rape of a male aged 16 and over,Sexual offences,Rape offences,19F,18
2023/24,1,South Wales,Rape of a male child under 13,Sexual offences,Rape offences,19H,7
2023/24,1,South Wales,Rape of a male child under 16,Sexual offences,Rape offences,19G,4
2023/24,1,South Wales,Residential burglary of a home,Theft offences,Domestic burglary,28I,262
2023/24,1,South Wales,Residential burglary of unconnected building,Theft offences,Domestic burglary,28M,67
2023/24,1,South Wales,Robbery of business property,Robbery,Robbery of business property,34A,6
2023/24,1,South Wales,Robbery of personal property,Robbery,Robbery of personal property,34B,104
2023/24,1,South Wales,Sexual activity etc with a person with a mental disorder,Sexual offences,Other sexual offences,70,1
2023/24,1,South Wales,Sexual activity involving a child under 13,Sexual offences,Other sexual offences,21,49
2023/24,1,South Wales,Sexual activity involving child under 16,Sexual offences,Other sexual offences,22B,109
2023/24,1,South Wales,Sexual assault on a female aged 13 and over,Sexual offences,Other sexual offences,20A,282
2023/24,1,South Wales,Sexual assault on a female child under 13,Sexual offences,Other sexual offences,20B,63
2023/24,1,South Wales,Sexual assault on a male aged 13 and over,Sexual offences,Other sexual offences,17A,46
2023/24,1,South Wales,Sexual assault on a male child under 13,Sexual offences,Other sexual offences,17B,29
2023/24,1,South Wales,Sexual grooming,Sexual offences,Other sexual offences,88A,106
2023/24,1,South Wales,Shoplifting,Theft offences,Shoplifting,46,2949
2023/24,1,South Wales,Soliciting for the purposes of prostitution,Miscellaneous crimes against society,Miscellaneous crimes against society,27,0
2023/24,1,South Wales,Stalking,Violence against the person,Stalking and harassment,8Q,744
2023/24,1,South Wales,Theft by an employee,Theft offences,Other theft offences,41,25
2023/24,1,South Wales,Theft from automatic machine or meter,Theft offences,Other theft offences,47,3
2023/24,1,South Wales,Theft from the person,Theft offences,Theft from the person,39,240
2023/24,1,South Wales,Theft from vehicle,Theft offences,Theft from a vehicle,45,773
2023/24,1,South Wales,Theft in a dwelling other than from an automatic machine or meter,Theft offences,Other theft offences,40,227
2023/24,1,South Wales,Theft of mail,Theft offences,Other theft offences,42,23
2023/24,1,South Wales,Theft or unauthorised taking of a pedal cycle,Theft offences,Bicycle theft,44,457
2023/24,1,South Wales,Theft or unauthorised taking of motor vehicle,Theft offences,Theft of a motor vehicle,48,556
2023/24,1,South Wales,Threat or possession with intent to commit criminal damage,Miscellaneous crimes against society,Miscellaneous crimes against society,59,153
2023/24,1,South Wales,Threats to kill,Violence against the person,Violence without injury,3B,135
2023/24,1,South Wales,Trafficking for sexual exploitation,Sexual offences,Other sexual offences,72,0
2023/24,1,South Wales,Trafficking in controlled drugs,Drug offences,Trafficking of drugs,92A,206
2023/24,1,South Wales,Unnatural sexual offences,Sexual offences,Other sexual offences,88D,1
2023/24,1,South Wales,Violent disorder,Public order offences,Public order offences,62A,6
2023/24,1,South Wales,Wildlife,Miscellaneous crimes against society,Miscellaneous crimes against society,96,0
2023/24,1,South Yorkshire,Absconding from lawful custody,Miscellaneous crimes against society,Miscellaneous crimes against society,80,7
2023/24,1,South Yorkshire,Abuse of children through sexual exploitation,Sexual offences,Other sexual offences,71,4
2023/24,1,South Yorkshire,Abuse of position of trust of a sexual nature,Sexual offences,Other sexual offences,73,0
2023/24,1,South Yorkshire,Aggravated burglary - residential (home),Theft offences,Domestic burglary,29B,19
2023/24,1,South Yorkshire,Aggravated burglary - residential (unconnected building),Theft offences,Domestic burglary,29C,2
2023/24,1,South Yorkshire,Aggravated Burglary Business and Community,Theft offences,Non-domestic burglary,31A,2
2023/24,1,South Yorkshire,Aggravated burglary in a building other than a dwelling(outcome only),Theft offences,Non-domestic burglary,31,0
2023/24,1,South Yorkshire,Aggravated burglary in a dwelling (outcome only),Theft offences,Domestic burglary,29,0
2023/24,1,South Yorkshire,Aggravated Burglary Residential,Theft offences,Domestic burglary,29A,0
2023/24,1,South Yorkshire,Aggravated vehicle taking,Theft offences,Theft of a motor vehicle,37.2,50
2023/24,1,South Yorkshire,Aiding suicide,Miscellaneous crimes against society,Miscellaneous crimes against society,76,0
2023/24,1,South Yorkshire,Arson endangering life,Criminal damage and arson,Arson,56A,69
2023/24,1,South Yorkshire,Arson not endangering life,Criminal damage and arson,Arson,56B,233
2023/24,1,South Yorkshire,Assault with injury,Violence against the person,Violence with injury,8N,3778
2023/24,1,South Yorkshire,Assault with injury on a constable,Violence against the person,Violence with injury,8S,75
2023/24,1,South Yorkshire,Assault with intent to cause serious harm,Violence against the person,Violence with injury,5D,414
2023/24,1,South Yorkshire,Assault without injury,Violence against the person,Violence without injury,105A,4099
2023/24,1,South Yorkshire,Assault without injury on a constable,Violence against the person,Violence without injury,104,141
2023/24,1,South Yorkshire,Assaults on emergency workers (other than constables),Violence against the person,Violence with injury,8T,32
2023/24,1,South Yorkshire,Attempted Burglary Business and Community,Theft offences,Non-domestic burglary,30D,105
2023/24,1,South Yorkshire,Attempted burglary in a building other than a dwelling (outcome only),Theft offences,Non-domestic burglary,30B,0
2023/24,1,South Yorkshire,Attempted burglary in a dwelling (outcome only),Theft offences,Domestic burglary,28B,0
2023/24,1,South Yorkshire,Attempted Burglary Residential,Theft offences,Domestic burglary,28F,0
2023/24,1,South Yorkshire,Attempted distraction burglary - residential (home),Theft offences,Domestic burglary,28L,1
2023/24,1,South Yorkshire,Attempted distraction burglary - residential (unconnected building),Theft offences,Domestic burglary,28P,0
2023/24,1,South Yorkshire,Attempted distraction burglary in a dwelling (outcome only),Theft offences,Domestic burglary,28D,0
2023/24,1,South Yorkshire,Attempted Distraction Burglary Residential,Theft offences,Domestic burglary,28H,0
2023/24,1,South Yorkshire,Attempted murder,Violence against the person,Violence with injury,2,14
2023/24,1,South Yorkshire,Attempted residential burglary of a home,Theft offences,Domestic burglary,28J,536
2023/24,1,South Yorkshire,Attempted residential burglary of unconnected building,Theft offences,Domestic burglary,28N,45
2023/24,1,South Yorkshire,Bail offences,Miscellaneous crimes against society,Miscellaneous crimes against society,83,0
2023/24,1,South Yorkshire,Bigamy,Miscellaneous crimes against society,Miscellaneous crimes against society,26,0
2023/24,1,South Yorkshire,Blackmail,Theft offences,Other theft offences,35,222
2023/24,1,South Yorkshire,Burglary Business and Community,Theft offences,Non-domestic burglary,30C,598
2023/24,1,South Yorkshire,Burglary in a building other than a dwelling (outcome only),Theft offences,Non-domestic burglary,30A,0
2023/24,1,South Yorkshire,Burglary in a dwelling(outcome only),Theft offences,Domestic burglary,28A,0
2023/24,1,South Yorkshire,Burglary Residential,Theft offences,Domestic burglary,28E,0
2023/24,1,South Yorkshire,Causing death by aggravated vehicle taking,Violence against the person,Death or serious injury - unlawful driving,37.1,0
2023/24,1,South Yorkshire,Causing death by careless driving under influence of drink or drugs,Violence against the person,Death or serious injury - unlawful driving,4.6,0
2023/24,1,South Yorkshire,Causing death by careless or inconsiderate driving,Violence against the person,Death or serious injury - unlawful driving,4.8,0
2023/24,1,South Yorkshire,Causing death by driving: unlicensed or disqualified or uninsured drivers,Violence against the person,Death or serious injury - unlawful driving,4.9,0
2023/24,1,South Yorkshire,Causing death or serious injury by dangerous driving,Violence against the person,Death or serious injury - unlawful driving,4.4,7
2023/24,1,South Yorkshire,Causing or allowing death of child or vulnerable person,Violence against the person,Violence with injury,4.7,0
2023/24,1,South Yorkshire,Causing sexual activity without consent,Sexual offences,Other sexual offences,22A,8
2023/24,1,South Yorkshire,Child abduction,Violence against the person,Violence without injury,13,4
2023/24,1,South Yorkshire,Concealing an infant death close to birth,Miscellaneous crimes against society,Miscellaneous crimes against society,15,0
2023/24,1,South Yorkshire,Conspiracy to murder,Violence against the person,Violence without injury,3A,2
2023/24,1,South Yorkshire,Controlling and coercive behaviour,Violence against the person,Stalking and harassment,8U,331
2023/24,1,South Yorkshire,Corporate manslaughter,Violence against the person,Homicide,4.10,0
2023/24,1,South Yorkshire,Criminal damage to a building other than a dwelling,Criminal damage and arson,Criminal damage,58B,252
2023/24,1,South Yorkshire,Criminal damage to a dwelling,Criminal damage and arson,Criminal damage,58A,1410
2023/24,1,South Yorkshire,Criminal damage to a vehicle,Criminal damage and arson,Criminal damage,58C,1108
2023/24,1,South Yorkshire,Cruelty to children/young persons,Violence against the person,Violence without injury,11A,203
2023/24,1,South Yorkshire,Dangerous driving,Miscellaneous crimes against society,Miscellaneous crimes against society,802,14
2023/24,1,South Yorkshire,"Disclosure, obstruction, false or misleading statements etc",Miscellaneous crimes against society,Miscellaneous crimes against society,95,0
2023/24,1,South Yorkshire,Dishonest use of electricity,Theft offences,Other theft offences,43,35
2023/24,1,South Yorkshire,Distraction burglary - residential (home),Theft offences,Domestic burglary,28K,5
2023/24,1,South Yorkshire,Distraction burglary - residential (unconnected building),Theft offences,Domestic burglary,28O,0
2023/24,1,South Yorkshire,Distraction burglary in a dwelling (outcome only),Theft offences,Domestic burglary,28C,0
2023/24,1,South Yorkshire,Distraction Burglary Residential,Theft offences,Domestic burglary,28G,0
2023/24,1,South Yorkshire,Endangering life,Violence against the person,Violence with injury,5E,4
2023/24,1,South Yorkshire,Exploitation of prostitution,Miscellaneous crimes against society,Miscellaneous crimes against society,24,2
2023/24,1,South Yorkshire,Exposure and voyeurism,Sexual offences,Other sexual offences,88E,91
2023/24,1,South Yorkshire,Forgery or use of false drug prescription,Miscellaneous crimes against society,Miscellaneous crimes against society,60,0
2023/24,1,South Yorkshire,"Fraud, forgery etc associated with vehicle or driver records",Miscellaneous crimes against society,Miscellaneous crimes against society,814,6
