financialYear,financialQuarter,forceName,offenceDescription,offenceGroup,offenceSubgroup,offenceCode,numberofOffences
2023/24,1,Dyfed-Powys,Attempted distraction burglary - residential (unconnected building),Theft offences,Domestic burglary,28P,0
2023/24,1,Dyfed-Powys,Attempted distraction burglary in a dwelling (outcome only),Theft offences,Domestic burglary,28D,0
2023/24,1,Dyfed-Powys,Attempted Distraction Burglary Residential,Theft offences,Domestic burglary,28H,0
2023/24,1,Dyfed-Powys,Attempted murder,Violence against the person,Violence with injury,2,1
2023/24,1,Dyfed-Powys,Attempted residential burglary of a home,Theft offences,Domestic burglary,28J,20
2023/24,1,Dyfed-Powys,Attempted residential burglary of unconnected building,Theft offences,Domestic burglary,28N,3
2023/24,1,Dyfed-Powys,Bail offences,Miscellaneous crimes against society,Miscellaneous crimes against society,83,2
2023/24,1,Dyfed-Powys,Bigamy,Miscellaneous crimes against society,Miscellaneous crimes against society,26,0
2023/24,1,Dyfed-Powys,Blackmail,Theft offences,Other theft offences,35,79
2023/24,1,Dyfed-Powys,Burglary Business and Community,Theft offences,Non-domestic burglary,30C,98
2023/24,1,Dyfed-Powys,Burglary in a building other than a dwelling (outcome only),Theft offences,Non-domestic burglary,30A,0
2023/24,1,Dyfed-Powys,Burglary in a dwelling(outcome only),Theft offences,Domestic burglary,28A,0
2023/24,1,Dyfed-Powys,Burglary Residential,Theft offences,Domestic burglary,28E,88
2023/24,1,Dyfed-Powys,Causing death by aggravated vehicle taking,Violence against the person,Death or serious injury - unlawful driving,37.1,0
2023/24,1,Dyfed-Powys,Causing death by careless driving under influence of drink or drugs,Violence against the person,Death or serious injury - unlawful driving,4.6,0
2023/24,1,Dyfed-Powys,Causing death by careless or inconsiderate driving,Violence against the person,Death or serious injury - unlawful driving,4.8,1
2023/24,1,Dyfed-Powys,Causing death by driving: unlicensed or disqualified or uninsured drivers,Violence against the person,Death or serious injury - unlawful driving,4.9,0
2023/24,1,Dyfed-Powys,Causing death or serious injury by dangerous driving,Violence against the person,Death or serious injury - unlawful driving,4.4,0
2023/24,1,Dyfed-Powys,Causing or allowing death of child or vulnerable person,Violence against the person,Violence with injury,4.7,0
2023/24,1,Dyfed-Powys,Causing sexual activity without consent,Sexual offences,Other sexual offences,22A,5
2023/24,1,Dyfed-Powys,Child abduction,Violence against the person,Violence without injury,13,3
2023/24,1,Dyfed-Powys,Concealing an infant death close to birth,Miscellaneous crimes against society,Miscellaneous crimes against society,15,0
2023/24,1,Dyfed-Powys,Conspiracy to murder,Violence against the person,Violence without injury,3A,0
2023/24,1,Dyfed-Powys,Controlling and coercive behaviour,Violence against the person,Stalking and harassment,8U,150
2023/24,1,Dyfed-Powys,Corporate manslaughter,Violence against the person,Homicide,4.10,0
2023/24,1,Dyfed-Powys,Criminal damage to a building other than a dwelling,Criminal damage and arson,Criminal damage,58B,223
2023/24,1,Dyfed-Powys,Criminal damage to a dwelling,Criminal damage and arson,Criminal damage,58A,165
2023/24,1,Dyfed-Powys,Criminal damage to a vehicle,Criminal damage and arson,Criminal damage,58C,312
2023/24,1,Dyfed-Powys,Cruelty to children/young persons,Violence against the person,Violence without injury,11A,58
2023/24,1,Dyfed-Powys,Dangerous driving,Miscellaneous crimes against society,Miscellaneous crimes against society,802,5
2023/24,1,Dyfed-Powys,"Disclosure, obstruction, false or misleading statements etc",Miscellaneous crimes against society,Miscellaneous crimes against society,95,2
2023/24,1,Dyfed-Powys,Dishonest use of electricity,Theft offences,Other theft offences,43,3
2023/24,1,Dyfed-Powys,Distraction burglary - residential (home),Theft offences,Domestic burglary,28K,0
2023/24,1,Dyfed-Powys,Distraction burglary - residential (unconnected building),Theft offences,Domestic burglary,28O,0
2023/24,1,Dyfed-Powys,Distraction burglary in a dwelling (outcome only),Theft offences,Domestic burglary,28C,0
2023/24,1,Dyfed-Powys,Distraction Burglary Residential,Theft offences,Domestic burglary,28G,0
2023/24,1,Dyfed-Powys,Endangering life,Violence against the person,Violence with injury,5E,8
2023/24,1,Dyfed-Powys,Exploitation of prostitution,Miscellaneous crimes against society,Miscellaneous crimes against society,24,0
2023/24,1,Dyfed-Powys,Exposure and voyeurism,Sexual offences,Other sexual offences,88E,28
2023/24,1,Dyfed-Powys,Forgery or use of false drug prescription,Miscellaneous crimes against society,Miscellaneous crimes against society,60,1
2023/24,1,Dyfed-Powys,"Fraud, forgery etc associated with vehicle or driver records",Miscellaneous crimes against society,Miscellaneous crimes against society,814,1
2023/24,1,Dyfed-Powys,"Going equipped for stealing, etc",Miscellaneous crimes against society,Miscellaneous crimes against society,33,7
2023/24,1,Dyfed-Powys,Handling stolen goods,Miscellaneous crimes against society,Miscellaneous crimes against society,54,3
2023/24,1,Dyfed-Powys,Harassment,Violence against the person,Stalking and harassment,8L,1328
2023/24,1,Dyfed-Powys,Incest or familial sexual offences,Sexual offences,Other sexual offences,23,3
2023/24,1,Dyfed-Powys,Infanticide,Violence against the person,Homicide,4.2,0
2023/24,1,Dyfed-Powys,Intentional destruction of a viable unborn child,Violence against the person,Violence with injury,4.3,0
2023/24,1,Dyfed-Powys,Interfering with a motor vehicle,Theft offences,Vehicle interference,126,21
2023/24,1,Dyfed-Powys,Kidnapping,Violence against the person,Violence without injury,36,4
2023/24,1,Dyfed-Powys,Making off without payment,Theft offences,Other theft offences,49A,88
2023/24,1,Dyfed-Powys,"Making, supplying or possessing articles for use in fraud",Miscellaneous crimes against society,Miscellaneous crimes against society,33A,0
2023/24,1,Dyfed-Powys,Malicious Communications,Violence against the person,Stalking and harassment,8R,631
2023/24,1,Dyfed-Powys,Manslaughter,Violence against the person,Homicide,4.1,0
2023/24,1,Dyfed-Powys,Modern slavery,Violence against the person,Violence without injury,106,4
2023/24,1,Dyfed-Powys,Murder,Violence against the person,Homicide,1,1
2023/24,1,Dyfed-Powys,Obscene publications etc,Miscellaneous crimes against society,Miscellaneous crimes against society,86,75
2023/24,1,Dyfed-Powys,Offender Management Act offences,Miscellaneous crimes against society,Miscellaneous crimes against society,69,0
2023/24,1,Dyfed-Powys,Other criminal damage,Criminal damage and arson,Criminal damage,58D,399
2023/24,1,Dyfed-Powys,Other drug offences,Drug offences,Possession of drugs,92C,9
2023/24,1,Dyfed-Powys,Other firearms offences,Possession of weapons offences,Possession of weapons offences,81,3
2023/24,1,Dyfed-Powys,Other forgery,Miscellaneous crimes against society,Miscellaneous crimes against society,61,1
2023/24,1,Dyfed-Powys,Other knives offences,Possession of weapons offences,Possession of weapons offences,90,0
2023/24,1,Dyfed-Powys,Other miscellaneous sexual offences,Sexual offences,Other sexual offences,88C,5
2023/24,1,Dyfed-Powys,Other notifiable offences,Miscellaneous crimes against society,Miscellaneous crimes against society,99,24
2023/24,1,Dyfed-Powys,Other offences against the State or public order,Public order offences,Public order offences,66,101
2023/24,1,Dyfed-Powys,Other theft,Theft offences,Other theft offences,49,420
2023/24,1,Dyfed-Powys,Perjury,Miscellaneous crimes against society,Miscellaneous crimes against society,67,0
2023/24,1,Dyfed-Powys,Perverting the course of justice,Miscellaneous crimes against society,Miscellaneous crimes against society,79,17
2023/24,1,Dyfed-Powys,Possession of article with blade or point,Possession of weapons offences,Possession of weapons offences,10D,41
2023/24,1,Dyfed-Powys,Possession of controlled drugs (Cannabis),Drug offences,Possession of drugs,92E,277
2023/24,1,Dyfed-Powys,Possession of controlled drugs (excl. Cannabis),Drug offences,Possession of drugs,92D,106
2023/24,1,Dyfed-Powys,Possession of false documents,Miscellaneous crimes against society,Miscellaneous crimes against society,61A,0
2023/24,1,Dyfed-Powys,Possession of firearms offences,Possession of weapons offences,Possession of weapons offences,10B,12
2023/24,1,Dyfed-Powys,Possession of firearms with intent,Possession of weapons offences,Possession of weapons offences,10A,1
2023/24,1,Dyfed-Powys,Possession of other weapons,Possession of weapons offences,Possession of weapons offences,10C,26
2023/24,1,Dyfed-Powys,Procuring illegal abortion,Violence against the person,Violence without injury,14,0
2023/24,1,Dyfed-Powys,Profiting from or concealing knowledge of the proceeds of crime,Miscellaneous crimes against society,Miscellaneous crimes against society,38,0
2023/24,1,Dyfed-Powys,"Public fear, alarm or distress",Public order offences,Public order offences,9A,1368
2023/24,1,Dyfed-Powys,Racially or religiously aggravated assault with injury,Violence against the person,Violence with injury,8P,6
2023/24,1,Dyfed-Powys,Racially or religiously aggravated assault without injury,Violence against the person,Violence without injury,105B,14
2023/24,1,Dyfed-Powys,Racially or religiously aggravated criminal damage,Criminal damage and arson,Criminal damage,58J,8
2023/24,1,Dyfed-Powys,Racially or religiously aggravated harassment,Violence against the person,Stalking and harassment,8M,10
2023/24,1,Dyfed-Powys,"Racially or religiously aggravated public fear, alarm or distress",Public order offences,Public order offences,9B,69
2023/24,1,Dyfed-Powys,Rape of a Female - Multiple Undefined Offenders,Sexual offences,Rape offences,19J,4
2023/24,1,Dyfed-Powys,Rape of a female aged 16 and over,Sexual offences,Rape offences,19C,94
2023/24,1,Dyfed-Powys,Rape of a female child under 13,Sexual offences,Rape offences,19E,8
2023/24,1,Dyfed-Powys,Rape of a female child under 16,Sexual offences,Rape offences,19D,15
2023/24,1,Dyfed-Powys,Rape of a Male - Multiple Undefined Offenders,Sexual offences,Rape offences,19K,1
2023/24,1,Dyfed-Powys,Rape of a male aged 16 and over,Sexual offences,Rape offences,19F,4
2023/24,1,Dyfed-Powys,Rape of a male child under 13,Sexual offences,Rape offences,19H,4
2023/24,1,Dyfed-Powys,Rape of a male child under 16,Sexual offences,Rape offences,19G,6
2023/24,1,Dyfed-Powys,Residential burglary of a home,Theft offences,Domestic burglary,28I,75
2023/24,1,Dyfed-Powys,Residential burglary of unconnected building,Theft offences,Domestic burglary,28M,45
2023/24,1,Dyfed-Powys,Robbery of business property,Robbery,Robbery of business property,34A,3
2023/24,1,Dyfed-Powys,Robbery of personal property,Robbery,Robbery of personal property,34B,13
2023/24,1,Dyfed-Powys,Sexual activity etc with a person with a mental disorder,Sexual offences,Other sexual offences,70,1
2023/24,1,Dyfed-Powys,Sexual activity involving a child under 13,Sexual offences,Other sexual offences,21,10
2023/24,1,Dyfed-Powys,Sexual activity involving child under 16,Sexual offences,Other sexual offences,22B,29
2023/24,1,Dyfed-Powys,Sexual assault on a female aged 13 and over,Sexual offences,Other sexual offences,20A,121
2023/24,1,Dyfed-Powys,Sexual assault on a female child under 13,Sexual offences,Other sexual offences,20B,30
2023/24,1,Dyfed-Powys,Sexual assault on a male aged 13 and over,Sexual offences,Other sexual offences,17A,28
2023/24,1,Dyfed-Powys,Sexual assault on a male child under 13,Sexual offences,Other sexual offences,17B,10
2023/24,1,Dyfed-Powys,Sexual grooming,Sexual offences,Other sexual offences,88A,20
2023/24,1,Dyfed-Powys,Shoplifting,Theft offences,Shoplifting,46,483
2023/24,1,Dyfed-Powys,Soliciting for the purposes of prostitution,Miscellaneous crimes against society,Miscellaneous crimes against society,27,0
2023/24,1,Dyfed-Powys,Stalking,Violence against the person,Stalking and harassment,8Q,237
2023/24,1,Dyfed-Powys,Theft by an employee,Theft offences,Other theft offences,41,15
2023/24,1,Dyfed-Powys,Theft from automatic machine or meter,Theft offences,Other theft offences,47,2
2023/24,1,Dyfed-Powys,Theft from the person,Theft offences,Theft from the person,39,79
2023/24,1,Dyfed-Powys,Theft from vehicle,Theft offences,Theft from a vehicle,45,75
2023/24,1,Dyfed-Powys,Theft in a dwelling other than from an automatic machine or meter,Theft offences,Other theft offences,40,46
2023/24,1,Dyfed-Powys,Theft of mail,Theft offences,Other theft offences,42,7
2023/24,1,Dyfed-Powys,Theft or unauthorised taking of a pedal cycle,Theft offences,Bicycle theft,44,41
2023/24,1,Dyfed-Powys,Theft or unauthorised taking of motor vehicle,Theft offences,Theft of a motor vehicle,48,48
2023/24,1,Dyfed-Powys,Threat or possession with intent to commit criminal damage,Miscellaneous crimes against society,Miscellaneous crimes against society,59,64
2023/24,1,Dyfed-Powys,Threats to kill,Violence against the person,Violence without injury,3B,230
2023/24,1,Dyfed-Powys,Trafficking for sexual exploitation,Sexual offences,Other sexual offences,72,0
2023/24,1,Dyfed-Powys,Trafficking in controlled drugs,Drug offences,Trafficking of drugs,92A,67
2023/24,1,Dyfed-Powys,Unnatural sexual offences,Sexual offences,Other sexual offences,88D,0
2023/24,1,Dyfed-Powys,Violent disorder,Public order offences,Public order offences,62A,1
2023/24,1,Dyfed-Powys,Wildlife,Miscellaneous crimes against society,Miscellaneous crimes against society,96,9
2023/24,1,Essex,Absconding from lawful custody,Miscellaneous crimes against society,Miscellaneous crimes against society,80,1
2023/24,1,Essex,Abuse of children through sexual exploitation,Sexual offences,Other sexual offences,71,3
2023/24,1,Essex,Abuse of position of trust of a sexual nature,Sexual offences,Other sexual offences,73,3
2023/24,1,Essex,Aggravated burglary - residential (home),Theft offences,Domestic burglary,29B,24
2023/24,1,Essex,Aggravated burglary - residential (unconnected building),Theft offences,Domestic burglary,29C,0
2023/24,1,Essex,Aggravated Burglary Business and Community,Theft offences,Non-domestic burglary,31A,3
2023/24,1,Essex,Aggravated burglary in a building other than a dwelling(outcome only),Theft offences,Non-domestic burglary,31,0
2023/24,1,Essex,Aggravated burglary in a dwelling (outcome only),Theft offences,Domestic burglary,29,0
2023/24,1,Essex,Aggravated Burglary Residential,Theft offences,Domestic burglary,29A,0
2023/24,1,Essex,Aggravated vehicle taking,Theft offences,Theft of a motor vehicle,37.2,15
2023/24,1,Essex,Aiding suicide,Miscellaneous crimes against society,Miscellaneous crimes against society,76,0
2023/24,1,Essex,Arson endangering life,Criminal damage and arson,Arson,56A,35
2023/24,1,Essex,Arson not endangering life,Criminal damage and arson,Arson,56B,262
2023/24,1,Essex,Assault with injury,Violence against the person,Violence with injury,8N,3376
2023/24,1,Essex,Assault with injury on a constable,Violence against the person,Violence with injury,8S,57
2023/24,1,Essex,Assault with intent to cause serious harm,Violence against the person,Violence with injury,5D,339
2023/24,1,Essex,Assault without injury,Violence against the person,Violence without injury,105A,5901
2023/24,1,Essex,Assault without injury on a constable,Violence against the person,Violence without injury,104,314
2023/24,1,Essex,Assaults on emergency workers (other than constables),Violence against the person,Violence with injury,8T,25
2023/24,1,Essex,Attempted Burglary Business and Community,Theft offences,Non-domestic burglary,30D,64
2023/24,1,Essex,Attempted burglary in a building other than a dwelling (outcome only),Theft offences,Non-domestic burglary,30B,0
2023/24,1,Essex,Attempted burglary in a dwelling (outcome only),Theft offences,Domestic burglary,28B,0
2023/24,1,Essex,Attempted Burglary Residential,Theft offences,Domestic burglary,28F,0
2023/24,1,Essex,Attempted distraction burglary - residential (home),Theft offences,Domestic burglary,28L,0
2023/24,1,Essex,Attempted distraction burglary - residential (unconnected building),Theft offences,Domestic burglary,28P,0
2023/24,1,Essex,Attempted distraction burglary in a dwelling (outcome only),Theft offences,Domestic burglary,28D,0
2023/24,1,Essex,Attempted Distraction Burglary Residential,Theft offences,Domestic burglary,28H,0
2023/24,1,Essex,Attempted murder,Violence against the person,Violence with injury,2,16
2023/24,1,Essex,Attempted residential burglary of a home,Theft offences,Domestic burglary,28J,202
2023/24,1,Essex,Attempted residential burglary of unconnected building,Theft offences,Domestic burglary,28N,62
2023/24,1,Essex,Bail offences,Miscellaneous crimes against society,Miscellaneous crimes against society,83,1
2023/24,1,Essex,Bigamy,Miscellaneous crimes against society,Miscellaneous crimes against society,26,0
2023/24,1,Essex,Blackmail,Theft offences,Other theft offences,35,343
2023/24,1,Essex,Burglary Business and Community,Theft offences,Non-domestic burglary,30C,381
2023/24,1,Essex,Burglary in a building other than a dwelling (outcome only),Theft offences,Non-domestic burglary,30A,0
2023/24,1,Essex,Burglary in a dwelling(outcome only),Theft offences,Domestic burglary,28A,0
2023/24,1,Essex,Burglary Residential,Theft offences,Domestic burglary,28E,0
2023/24,1,Essex,Causing death by aggravated vehicle taking,Violence against the person,Death or serious injury - unlawful driving,37.1,0
2023/24,1,Essex,Causing death by careless driving under influence of drink or drugs,Violence against the person,Death or serious injury - unlawful driving,4.6,0
2023/24,1,Essex,Causing death by careless or inconsiderate driving,Violence against the person,Death or serious injury - unlawful driving,4.8,2
2023/24,1,Essex,Causing death by driving: unlicensed or disqualified or uninsured drivers,Violence against the person,Death or serious injury - unlawful driving,4.9,0
2023/24,1,Essex,Causing death or serious injury by dangerous driving,Violence against the person,Death or serious injury - unlawful driving,4.4,4
2023/24,1,Essex,Causing or allowing death of child or vulnerable person,Violence against the person,Violence with injury,4.7,1
2023/24,1,Essex,Causing sexual activity without consent,Sexual offences,Other sexual offences,22A,12
2023/24,1,Essex,Child abduction,Violence against the person,Violence without injury,13,7
2023/24,1,Essex,Concealing an infant death close to birth,Miscellaneous crimes against society,Miscellaneous crimes against society,15,0
2023/24,1,Essex,Conspiracy to murder,Violence against the person,Violence without injury,3A,0
2023/24,1,Essex,Controlling and coercive behaviour,Violence against the person,Stalking and harassment,8U,265
2023/24,1,Essex,Corporate manslaughter,Violence against the person,Homicide,4.10,0
2023/24,1,Essex,Criminal damage to a building other than a dwelling,Criminal damage and arson,Criminal damage,58B,408
2023/24,1,Essex,Criminal damage to a dwelling,Criminal damage and arson,Criminal damage,58A,806
2023/24,1,Essex,Criminal damage to a vehicle,Criminal damage and arson,Criminal damage,58C,1080
2023/24,1,Essex,Cruelty to children/young persons,Violence against the person,Violence without injury,11A,317
2023/24,1,Essex,Dangerous driving,Miscellaneous crimes against society,Miscellaneous crimes against society,802,13
2023/24,1,Essex,"Disclosure, obstruction, false or misleading statements etc",Miscellaneous crimes against society,Miscellaneous crimes against society,95,2
2023/24,1,Essex,Dishonest use of electricity,Theft offences,Other theft offences,43,6
2023/24,1,Essex,Distraction burglary - residential (home),Theft offences,Domestic burglary,28K,4
2023/24,1,Essex,Distraction burglary - residential (unconnected building),Theft offences,Domestic burglary,28O,0
2023/24,1,Essex,Distraction burglary in a dwelling (outcome only),Theft offences,Domestic burglary,28C,0
2023/24,1,Essex,Distraction Burglary Residential,Theft offences,Domestic burglary,28G,0
2023/24,1,Essex,Endangering life,Violence against the person,Violence with injury,5E,7
2023/24,1,Essex,Exploitation of prostitution,Miscellaneous crimes against society,Miscellaneous crimes against society,24,0
2023/24,1,Essex,Exposure and voyeurism,Sexual offences,Other sexual offences,88E,97
2023/24,1,Essex,Forgery or use of false drug prescription,Miscellaneous crimes against society,Miscellaneous crimes against society,60,3
2023/24,1,Essex,"Fraud, forgery etc associated with vehicle or driver records",Miscellaneous crimes against society,Miscellaneous crimes against society,814,6
2023/24,1,Essex,"Going equipped for stealing, etc",Miscellaneous crimes against society,Miscellaneous crimes against society,33,13
2023/24,1,Essex,Handling stolen goods,Miscellaneous crimes against society,Miscellaneous crimes against society,54,26
2023/24,1,Essex,Harassment,Violence against the person,Stalking and harassment,8L,2405
2023/24,1,Essex,Incest or familial sexual offences,Sexual offences,Other sexual offences,23,15
2023/24,1,Essex,Infanticide,Violence against the person,Homicide,4.2,0
2023/24,1,Essex,Intentional destruction of a viable unborn child,Violence against the person,Violence with injury,4.3,0
2023/24,1,Essex,Interfering with a motor vehicle,Theft offences,Vehicle interference,126,408
2023/24,1,Essex,Kidnapping,Violence against the person,Violence without injury,36,70
2023/24,1,Essex,Making off without payment,Theft offences,Other theft offences,49A,474
2023/24,1,Essex,"Making, supplying or possessing articles for use in fraud",Miscellaneous crimes against society,Miscellaneous crimes against society,33A,15
2023/24,1,Essex,Malicious Communications,Violence against the person,Stalking and harassment,8R,1402
2023/24,1,Essex,Manslaughter,Violence against the person,Homicide,4.1,0
2023/24,1,Essex,Modern slavery,Violence against the person,Violence without injury,106,72
2023/24,1,Essex,Murder,Violence against the person,Homicide,1,2
2023/24,1,Essex,Obscene publications etc,Miscellaneous crimes against society,Miscellaneous crimes against society,86,337
2023/24,1,Essex,Offender Management Act offences,Miscellaneous crimes against society,Miscellaneous crimes against society,69,7
2023/24,1,Essex,Other criminal damage,Criminal damage and arson,Criminal damage,58D,1083
2023/24,1,Essex,Other drug offences,Drug offences,Possession of drugs,92C,1
2023/24,1,Essex,Other firearms offences,Possession of weapons offences,Possession of weapons offences,81,58
2023/24,1,Essex,Other forgery,Miscellaneous crimes against society,Miscellaneous crimes against society,61,12
2023/24,1,Essex,Other knives offences,Possession of weapons offences,Possession of weapons offences,90,0
2023/24,1,Essex,Other miscellaneous sexual offences,Sexual offences,Other sexual offences,88C,0
2023/24,1,Essex,Other notifiable offences,Miscellaneous crimes against society,Miscellaneous crimes against society,99,52
2023/24,1,Essex,Other offences against the State or public order,Public order offences,Public order offences,66,476
2023/24,1,Essex,Other theft,Theft offences,Other theft offences,49,2110
2023/24,1,Essex,Perjury,Miscellaneous crimes against society,Miscellaneous crimes against society,67,1
2023/24,1,Essex,Perverting the course of justice,Miscellaneous crimes against society,Miscellaneous crimes against society,79,35
2023/24,1,Essex,Possession of article with blade or point,Possession of weapons offences,Possession of weapons offences,10D,215
2023/24,1,Essex,Possession of controlled drugs (Cannabis),Drug offences,Possession of drugs,92E,854
2023/24,1,Essex,Possession of controlled drugs (excl. Cannabis),Drug offences,Possession of drugs,92D,154
2023/24,1,Essex,Possession of false documents,Miscellaneous crimes against society,Miscellaneous crimes against society,61A,3
2023/24,1,Essex,Possession of firearms offences,Possession of weapons offences,Possession of weapons offences,10B,22
2023/24,1,Essex,Possession of firearms with intent,Possession of weapons offences,Possession of weapons offences,10A,15
2023/24,1,Essex,Possession of other weapons,Possession of weapons offences,Possession of weapons offences,10C,168
2023/24,1,Essex,Procuring illegal abortion,Violence against the person,Violence without injury,14,0
2023/24,1,Essex,Profiting from or concealing knowledge of the proceeds of crime,Miscellaneous crimes against society,Miscellaneous crimes against society,38,25
2023/24,1,Essex,"Public fear, alarm or distress",Public order offences,Public order offences,9A,2623
2023/24,1,Essex,Racially or religiously aggravated assault with injury,Violence against the person,Violence with injury,8P,26
2023/24,1,Essex,Racially or religiously aggravated assault without injury,Violence against the person,Violence without injury,105B,130
2023/24,1,Essex,Racially or religiously aggravated criminal damage,Criminal damage and arson,Criminal damage,58J,37
2023/24,1,Essex,Racially or religiously aggravated harassment,Violence against the person,Stalking and harassment,8M,82
2023/24,1,Essex,"Racially or religiously aggravated public fear, alarm or distress",Public order offences,Public order offences,9B,295
2023/24,1,Essex,Rape of a Female - Multiple Undefined Offenders,Sexual offences,Rape offences,19J,12
2023/24,1,Essex,Rape of a female aged 16 and over,Sexual offences,Rape offences,19C,480
2023/24,1,Essex,Rape of a female child under 13,Sexual offences,Rape offences,19E,44
2023/24,1,Essex,Rape of a female child under 16,Sexual offences,Rape offences,19D,75
2023/24,1,Essex,Rape of a Male - Multiple Undefined Offenders,Sexual offences,Rape offences,19K,3
2023/24,1,Essex,Rape of a male aged 16 and over,Sexual offences,Rape offences,19F,32
2023/24,1,Essex,Rape of a male child under 13,Sexual offences,Rape offences,19H,18
2023/24,1,Essex,Rape of a male child under 16,Sexual offences,Rape offences,19G,4
2023/24,1,Essex,Residential burglary of a home,Theft offences,Domestic burglary,28I,646
